calories,cook,directions,ingredients,name,prep,rating,ready in,url,keyword,veg/nonveg,core
381,15 mins,"1. Peel and quarter potatoes; place in a large pot. Cover with salted water and bring to a boil. Cook until tender but still firm, about 15 minutes. Drain and return potatoes to the pot over low heat to dry for 1 to 2 minutes. 2. Add Parmesan cheese, cream cheese, chives, butter, garlic, salt, and pepper. Use a potato masher to mash until smooth and serve.","5 pounds Yukon Gold potatoes, 2 cups Parmesan cheese, 1 ½ cups cream cheese, 1 cup chopped fresh chives, ½ cup butter, ½ medium head garlic, peeled and minced, 1 pinch salt and pepper to taste",The Best Mashed Potatoes,5 mins,4.5,20 mins,https://www.allrecipes.com/recipe/15213/the-best-mashed-potatoes/,"['potato', 'parmesan', 'cheese', 'cream', 'cheese', 'chive', 'butter', 'garlic', 'salt', 'pepper']",veg,"['potato', 'parmesan', 'cheese', 'cream', 'cheese', 'chive', 'butter', 'garlic', 'salt', 'pepper']"
181,10 mins,"1. Place bacon in a large, deep skillet. Cook over medium high heat until evenly brown. Drain on paper towels. 2. In a medium bowl, combine mayonnaise and sour cream. Crumble bacon into the sour cream and mayonnaise mixture. Mix in tomatoes just before serving.","1 pound bacon, 1 cup mayonnaise, 1 cup sour cream, 1 tomato - peeled, seeded and diced",BLT Dip,5 mins,4.5,25 mins,https://www.allrecipes.com/recipe/14944/blt-dip/,"['bacon', 'mayonnaise', 'cream', 'tomato']",veg,"['bacon', 'mayonnaise', 'cream', 'tomato']"
255,15 mins,"1. Preheat the oven to 450 degrees F (220 degrees C). Line a baking sheet with aluminum foil, and coat with olive oil. 2. Wrap one slice of prosciutto around each asparagus spear, starting at the bottom, and spiraling up to the tip. Place the wrapped spears on the prepared baking sheet. 3. Bake in the preheated oven for 5 minutes. Remove, and shake the pan back and forth to roll the spears over. Return to the oven until asparagus is tender and prosciutto is crisp, another 5 minutes. Serve immediately.","1 tablespoon olive oil, 16 spears fresh asparagus, trimmed, 16 slices prosciutto",Asparagus Wrapped in Crisp Prosciutto,5 mins,4.5,20 mins,https://www.allrecipes.com/recipe/73565/asparagus-wrapped-in-crisp-prosciutto/,"['oil', 'asparagus', 'prosciutto']",veg,"['oil', 'asparagus', 'prosciutto']"
548,8 mins,"1. Toast the cumin seeds in a medium saute pan over medium-low heat for 5 minutes, or until fragrant. 2. In a blender, combine the cumin seeds, jalapenos, garlic, pepper, lime juice, and salt. Pulse the blender to finely chop ingredients. Add the oil and cilantro and puree until smooth. 3. Lightly score both sides of the meat with a knife so that the marinade will penetrate. Place the meat in a large plastic bag or bowl, pour in the marinade, and coat well. Marinate in the refrigerator for 24 to 48 hours. 4. Preheat an outdoor grill for high heat and lightly oil grate. 5. Remove the meat from the marinade and discard the remaining marinade. Cook on high, 1 to 2 minutes per side, to sear the meat. Turn the heat down to low and cook for an additional 3 to 4 minutes per side, or until the it has reached the desired doneness.","½ cup cumin seeds, 5 jalapeno peppers, seeds and ribs removed, chopped, 3 cloves garlic, 1 tablespoon cracked black pepper, ⅓ cup fresh lime juice, 1 ½ teaspoons salt, 1 ½ cups olive oil, 2 bunches cilantro (leaves and stems), 1 (3 pound) skirt or flank steak",Grilled Mexican Steak,12 mins,4.5,1 day 20 mins,https://www.allrecipes.com/recipe/47844/grilled-mexican-steak/,"['cumin', 'jalapeno', 'pepper', 'rib', 'clove', 'garlic', 'pepper', 'lime', 'salt', 'oil', 'cilantro']",veg,"['cumin', 'jalapeno', 'pepper', 'rib', 'clove', 'garlic', 'pepper', 'lime', 'salt', 'oil', 'cilantro']"
276,10 hrs,"1. In a large bowl, combine ketchup, brown sugar, red wine vinegar, Dijon-style mustard, Worcestershire sauce, and liquid smoke. Stir in salt, pepper, and garlic powder. 2. Place chuck roast in a slow cooker. Pour ketchup mixture over chuck roast. Cover, and cook on Low for 8 to 10 hours. 3. Remove chuck roast from slow cooker, shred with a fork, and return to the slow cooker. Stir meat to evenly coat with sauce. Continue cooking approximately 1 hour.","1 ½ cups ketchup, ¼ cup packed brown sugar, ¼ cup red wine vinegar, 2 tablespoons prepared Dijon-style mustard, 2 tablespoons Worcestershire sauce, 1 teaspoon liquid smoke flavoring, ½ teaspoon salt, ¼ teaspoon ground black pepper, ¼ teaspoon garlic powder, 1 (4 pound) boneless chuck roast",Barbecued Beef,20 mins,4.5,10 hrs 20 mins,https://www.allrecipes.com/recipe/14646/barbecued-beef/,"['ketchup', 'sugar', 'vinegar', 'mustard', 'worcestershire', 'sauce', 'salt', 'pepper', 'garlic', 'roast']",non-veg,"['ketchup', 'sugar', 'vinegar', 'mustard', 'worcestershire', 'sauce', 'salt', 'pepper', 'garlic']"
132,10 mins,"1. Whisk together egg, almond flour, and baking powder. Stir in mozzarella cheese and set batter aside. 2. Preheat a waffle iron according to manufacturer's instructions. 3. Spray both sides of the preheated waffle iron with cooking spray. Pour 1/2 of the batter onto the waffle iron and spread it out from the center with a spoon. Close the waffle maker and cook until chaffle reaches your desired doneness, about 3 minutes. Carefully lift chaffle out of the waffle iron and repeat with remaining batter. Allow chaffles to cool for 2 to 3 minutes, and they will begin to crisp up.","1 large egg, 1 tablespoon blanched almond flour, ¼ teaspoon baking powder, ½ cup shredded mozzarella cheese, cooking spray",Chaffles with Almond Flour,5 mins,4.5,20 mins,https://www.allrecipes.com/recipe/278328/chaffles-with-almond-flour/,"['egg', 'almond', 'flour', 'mozzarella', 'cheese']",non-veg,"['egg', 'almond', 'flour', 'mozzarella', 'cheese']"
203,20 mins,"1. Preheat the oven to 350 degrees F (175 degrees C). Line a 12-cup muffin tin with paper liners. 2. Whisk almond flour, baking soda, and salt together in a large bowl. Add coconut oil, maple syrup, eggs, lemon zest, and vanilla; mix until combined. Fold in frozen blueberries and spoon into the prepared muffin cups. 3. Bake in the preheated oven until tops spring back when lightly pressed, 18 to 20 minutes. Cool in the tin for 5 minutes. Transfer to a wire rack to cool completely.","2 cups finely ground almond flour, ½ teaspoon baking soda, ¼ teaspoon salt, ¼ cup coconut oil, melted and cooled, ¼ cup pure maple syrup, 3 large eggs, 1 tablespoon lemon zest, 1 teaspoon vanilla extract, 1 cup frozen blueberries",Almond Flour Blueberry Muffins,10 mins,4.5,35 mins,https://www.allrecipes.com/recipe/283581/almond-flour-blueberry-muffins/,"['almond', 'flour', 'soda', 'salt', 'coconut', 'oil', 'maple', 'syrup', 'egg', 'lemon', 'vanilla', 'blueberry']",non-veg,"['almond', 'flour', 'soda', 'salt', 'coconut', 'oil', 'maple', 'syrup', 'egg', 'lemon', 'vanilla', 'blueberry']"
449,20 mins,"1. Heat a large skillet over medium-high heat. Cook and stir beef and black pepper in the hot skillet until browned and crumbly, 5 to 7 minutes; drain and discard grease. 2. Stir tomato sauce, tomatoes, salt, basil, oregano, garlic powder, onion powder, thyme, and red pepper flakes into ground beef; cook and stir until sauce is warmed through, about 2 minutes. Stir in tomato paste. 3. Mix zucchini ""noodles"" into sauce, pressing down to fully submerge them; simmer over medium-low heat until zucchini is tender, about 10 minutes.","1 pound ground beef, 1 teaspoon ground black pepper, 1 (15 ounce) can tomato sauce, 1 (14.5 ounce) can whole peeled tomatoes, 1 tablespoon salt, or more to taste, 1 teaspoon dried basil, ½ teaspoon dried oregano, ½ teaspoon garlic powder, ½ teaspoon onion powder, ¼ teaspoon ground thyme, ¼ teaspoon red pepper flakes, 1 (6 ounce) can tomato paste, 3 zucchini, cut into long strands",Zucchini Spaghetti,10 mins,4.5,30 mins,https://www.allrecipes.com/recipe/241980/zucchini-spaghetti/,"['beef', 'pepper', 'tomato', 'sauce', 'tomato', 'salt', 'basil', 'oregano', 'garlic', 'onion', 'thyme', 'pepper', 'tomato', 'zucchini']",non-veg,"['beef', 'pepper', 'tomato', 'sauce', 'tomato', 'salt', 'basil', 'oregano', 'garlic', 'onion', 'thyme', 'pepper', 'tomato', 'zucchini']"
465,10 mins,"1. Preheat oven to 350 degrees F (175 degrees C). Combine melted butter and lemon juice in a small bowl. Brush 2 tablespoons of this mixture on a piece of foil placed on the broiler pan. 2. Mix together garlic salt, parsley, paprika and white pepper. Sprinkle spice mixture on both sides of fillets. 3. Bake fillets until meat flakes, about 10 minutes. Brush fillets again with lemon butter and spread with mayonnaise. Sprinkle with paprika before serving.","½ cup butter, melted, 2 tablespoons lemon juice, ¼ teaspoon garlic salt, ½ teaspoon dried parsley, ⅛ teaspoon paprika, ¼ teaspoon ground white pepper, 2 pounds grouper fillets, 2 tablespoons mayonnaise, ⅛ teaspoon paprika",Super Grouper,10 mins,4.0,20 mins,https://www.allrecipes.com/recipe/19517/super-grouper/,"['butter', 'lemon', 'garlic', 'salt', 'parsley', 'paprika', 'pepper', 'grouper', 'mayonnaise', 'paprika']",veg,"['butter', 'lemon', 'garlic', 'salt', 'parsley', 'paprika', 'pepper', 'grouper', 'mayonnaise', 'paprika']"
218,30 mins,"1. Preheat the oven to 450 degrees F (230 degrees C). Lightly grease a baking sheet with cooking spray. 2. Whisk together water, flour, garlic powder, salt, and pepper in a large bowl until batter is smooth and somewhat runny. Add cauliflower pieces to batter and mix until evenly coated; spread onto the prepared baking sheet. 3. Bake in the preheated oven until lightly browned, 20 to 25 minutes. Set aside. 4. Melt butter in a saucepan over medium heat. Remove from heat; stir in hot pepper sauce and honey until smooth. Brush hot sauce mixture over each cauliflower piece, repeating until all is used. 5. Return to the oven and bake until cauliflower is browned, about 10 minutes. Let cool for 10 to 15 minutes before serving.","olive oil cooking spray, 1 cup water, ¾ cup gluten-free baking flour (such as Premium Gold® Flax and Ancient Grains All-Purpose Flour), ½ teaspoon garlic powder, or to taste, salt and ground black pepper to taste, 2 heads cauliflower, cut into bite-size pieces, 2 tablespoons butter, ½ cup hot pepper sauce (such as Frank's RedHot®), 1 teaspoon honey",Buffalo Cauliflower,15 mins,4.5,55 mins,https://www.allrecipes.com/recipe/239616/buffalo-cauliflower/,"['oil', 'water', 'flour', 'flax', 'garlic', 'salt', 'pepper', 'cauliflower', 'butter', 'pepper', 'sauce', 'honey']",veg,"['oil', 'water', 'flour', 'flax', 'garlic', 'salt', 'pepper', 'cauliflower', 'butter', 'pepper', 'sauce', 'honey']"
126,30 mins,"1. Preheat oven to 350 degrees F (175 degrees C). Lightly grease an 8x8 square baking dish. 2. Combine the black beans, eggs, oil, cocoa powder, salt, vanilla extract, sugar, and instant coffee in a blender; blend until smooth; pour the mixture into the prepared baking dish. Sprinkle the chocolate chips over the top of the mixture. 3. Bake in the preheated oven until the top is dry and the edges start to pull away from the sides of the pan, about 30 minutes.","1 (15.5 ounce) can black beans, rinsed and drained, 3 eggs, 3 tablespoons vegetable oil, ¼ cup cocoa powder, 1 pinch salt, 1 teaspoon vanilla extract, ¾ cup white sugar, 1 teaspoon instant coffee (Optional), ½ cup milk chocolate chips (Optional)",Black Bean Brownies,10 mins,4.0,40 mins,https://www.allrecipes.com/recipe/161701/black-bean-brownies/,"['bean', 'egg', 'oil', 'cocoa', 'salt', 'vanilla', 'sugar', 'coffee', 'milk', 'chocolate', 'chip']",non-veg,"['bean', 'egg', 'oil', 'cocoa', 'salt', 'vanilla', 'sugar', 'coffee', 'milk', 'chocolate', 'chip']"
211,15 mins,"1. In a large bowl, stir together the green onions, lemon grass, cilantro, mint leaves, lime juice, fish sauce, chili sauce and sugar until well combined and the sugar is dissolved. Adjust the flavor, if desired, by adding more sugar and/or fish sauce. Set aside. 2. Cook the steak over high heat on a preheated grill for approximately 4-6 minutes on each side, until it is cooked medium. Do not overcook the meat! Remove from heat and slice into thin strips. Add the meat and its juices to the sauce and refrigerate, tightly covered, for at least 3 hours. 3. Tear the lettuce into bite size pieces and place in a salad bowl. Arrange the cucumber on top of the lettuce, and then pour the meat and sauce over. Top with the cherry tomatoes and garnish with fresh cilantro leaves.","2 green onions, chopped, 1 lemon grass, cut into 1 inch pieces, 1 cup chopped fresh cilantro, 1 cup chopped fresh mint leaves, 1 cup lime juice, ⅓ cup fish sauce, 1 tablespoon sweet chili sauce, ½ cup white sugar, 1 ½ pounds (1 inch thick) steak fillet, 1 head leaf lettuce - rinsed, dried and torn into bite-size pieces, ½ English cucumber, diced, 1 pint cherry tomatoes",Thai Beef Salad,30 mins,4.5,3 hrs 45 mins,https://www.allrecipes.com/recipe/19607/thai-beef-salad/,"['onion', 'lemon', 'cilantro', 'mint', 'lime', 'fish', 'sauce', 'chili', 'sauce', 'sugar', 'cucumber', 'cherry', 'tomato']",non-veg,"['onion', 'lemon', 'cilantro', 'mint', 'lime', 'fish', 'sauce', 'chili', 'sauce', 'sugar', 'cucumber', 'cherry', 'tomato']"
344,9 hrs,"1. Place roast into slow cooker. Sprinkle with garlic powder and onion powder, and season with salt and pepper. Pour barbeque sauce over meat. Cook on Low for 6 to 8 hours. 2. Remove meat from slow cooker, shred, and return to slow cooker. Cook for 1 more hour. Serve hot.","1 (3 pound) boneless chuck roast, 1 teaspoon garlic powder, 1 teaspoon onion powder, salt and pepper to taste, 1 (18 ounce) bottle barbeque sauce",Slow Cooker Barbeque,10 mins,4.5,9 hrs 10 mins,https://www.allrecipes.com/recipe/14608/slow-cooker-barbeque/,"['roast', 'garlic', 'onion', 'salt', 'pepper', 'sauce']",non-veg,"['garlic', 'onion', 'salt', 'pepper', 'sauce']"
196,12 mins,"1. Preheat oven to 350 degrees F (175 degrees C). Line a baking sheet with parchment paper. 2. Combine almond flour, butter, egg, sweetener, vanilla extract, and cinnamon in a bowl; mix until well combined. 3. Roll dough into 1-inch balls. Place on the prepared baking sheet and press down with a fork twice in a criss-cross pattern. 4. Bake in the the preheated oven until edges are golden, 12 to 15 minutes. Cool on the baking sheet for 1 minute before removing to a wire rack to cool completely.","2 cups blanched almond flour, ½ cup butter, softened, 1 egg, ½ cup low-calorie natural sweetener (such as Swerve®), 1 teaspoon sugar-free vanilla extract, 1 teaspoon ground cinnamon",Low-Carb Almond Cinnamon Butter Cookies,10 mins,4.5,23 mins,https://www.allrecipes.com/recipe/261182/low-carb-almond-cinnamon-butter-cookies/,"['almond', 'flour', 'butter', 'egg', 'vanilla', 'cinnamon']",non-veg,"['almond', 'flour', 'butter', 'egg', 'vanilla', 'cinnamon']"
102,,"1. In a medium bowl, beat together cream cheese and butter until smooth. Mix in confectioners' sugar, brown sugar and vanilla. Stir in chocolate chips. Cover, and chill in the refrigerator for 2 hours. 2. Shape chilled cream cheese mixture into a ball. Wrap with plastic, and chill in the refrigerator for 1 hour. 3. Roll the cheese ball in finely chopped pecans before serving.","1 (8 ounce) package cream cheese, softened, ½ cup butter, softened, ¾ cup confectioners' sugar, 2 tablespoons brown sugar, ¼ teaspoon vanilla extract, ¾ cup miniature semisweet chocolate chips, ¾ cup finely chopped pecans",Chocolate Chip Cheese Ball,20 mins,4.5,3 hrs 20 mins,https://www.allrecipes.com/recipe/26740/chocolate-chip-cheese-ball/,"['cream', 'cheese', 'butter', 'sugar', 'sugar', 'vanilla', 'chocolate', 'chip', 'pecan']",veg,"['cream', 'cheese', 'butter', 'sugar', 'sugar', 'vanilla', 'chocolate', 'chip', 'pecan']"
356,30 mins,"1. Preheat an outdoor grill for high heat. 2. Lightly oil the grill grate. Grill the chicken 8 to 12 minutes on each side, or until juices run clear. (You can deep fry or bake the chicken instead if you want to, but it is best when grilled.) Remove chicken to a large roasting pan. 3. In a saucepan over medium heat, mix the hot sauce, butter, honey, garlic salt, black pepper, and cayenne pepper. Simmer about 10 minutes, until blended and heated through. Pour the sauce over the grilled chicken wings and stir to coat.","6 pounds chicken wings, separated at joints, tips discarded, 1 ½ cups Louisiana-style hot sauce, ¾ cup butter, 1 cup honey, 1 pinch garlic salt, 1 pinch ground black pepper, 1 teaspoon cayenne pepper, or to taste",Sweet Spicy Wings,15 mins,4.5,45 mins,https://www.allrecipes.com/recipe/8768/sweet-spicy-wings/,"['chicken', 'sauce', 'butter', 'honey', 'garlic', 'salt', 'pepper', 'cayenne', 'pepper']",non-veg,"['chicken', 'sauce', 'butter', 'honey', 'garlic', 'salt', 'pepper', 'cayenne', 'pepper']"
355,4 hrs 30 mins,"1. Pour can of beef broth into slow cooker, and add boneless pork ribs. Cook on High heat for 4 hours, or until meat shreds easily. Remove meat, and shred with two forks. It will seem that it's not working right away, but it will. 2. Preheat oven to 350 degrees F (175 degrees C). Transfer the shredded pork to a Dutch oven or iron skillet, and stir in barbeque sauce. 3. Bake in the preheated oven for 30 minutes, or until heated through.","1 (14 ounce) can beef broth, 3 pounds boneless pork ribs, 1 (18 ounce) bottle barbeque sauce",BBQ Pork for Sandwiches,15 mins,5.0,4 hrs 45 mins,https://www.allrecipes.com/recipe/21174/bbq-pork-for-sandwiches/,"['beef', 'pork', 'rib', 'sauce']",non-veg,"['beef', 'pork', 'rib', 'sauce']"
271,15 mins,"1. In large saucepan, heat oil over medium-high. Add onion, cook and stir until tender. Add beans, tomatoes, oregano and garlic powder. Bring to a boil; stir in rice. Cover; reduce heat and simmer 5 minutes. Remove from heat; let stand 5 minutes before serving.","1 tablespoon vegetable oil, 1 onion, chopped, 1 (15 ounce) can black beans, undrained, 1 (14.5 ounce) can stewed tomatoes, 1 teaspoon dried oregano, ½ teaspoon garlic powder, 1 ½ cups uncooked instant brown rice",Quick Black Beans and Rice,5 mins,4.5,25 mins,https://www.allrecipes.com/recipe/13999/quick-black-beans-and-rice/,"['oil', 'onion', 'bean', 'tomato', 'oregano', 'garlic', 'rice']",veg,"['oil', 'onion', 'bean', 'tomato', 'oregano', 'garlic', 'rice']"
173,6 mins,"1. In a large, non-reactive bowl, stir together the olive oil, lemon juice, parsley, garlic, and black pepper. Season with crushed red pepper, if desired. Add shrimp, and toss to coat. Marinate in the refrigerator for 30 minutes. 2. Preheat grill for high heat. Thread shrimp onto skewers, piercing once near the tail and once near the head. Discard any remaining marinade. 3. Lightly oil grill grate. Grill for 2 to 3 minutes per side, or until opaque.","¼ cup olive oil, ¼ cup lemon juice, 3 tablespoons chopped fresh parsley, 1 tablespoon minced garlic, ground black pepper to taste, ¼ teaspoon crushed red pepper flakes to taste, 1 ½ pounds medium shrimp, peeled and deveined",Grilled Shrimp Scampi,30 mins,4.5,36 mins,https://www.allrecipes.com/recipe/12771/grilled-shrimp-scampi/,"['oil', 'lemon', 'parsley', 'garlic', 'pepper', 'pepper', 'shrimp']",non-veg,"['oil', 'lemon', 'parsley', 'garlic', 'pepper', 'pepper', 'shrimp']"
311,10 mins,"1. Mix ground lamb, onions, mint, cilantro, ginger paste, and chile paste together in a large bowl. Season with cumin, coriander, paprika, cayenne, and salt. Cover and chill in the refrigerator for 2 hours. Soak skewers in cold water. 2. Divide lamb mixture into 8 equal portions; mold portions onto skewers to form a sausage shape. Refrigerate skewers until you are ready to grill. 3. Preheat an outdoor grill for high heat and brush the grate liberally with oil. 4. Cook skewers on the preheated grill, turning frequently, until nicely browned on all sides, and meat is no longer pink in the center, about 10 minutes. An instant-read thermometer inserted into the center should read at least 160 degrees F (71 degrees C).","2 pounds lean ground lamb, 2 medium onions, finely chopped, ½ cup fresh mint leaves, finely chopped, ½ cup cilantro, finely chopped, 1 tablespoon ginger paste, 1 tablespoon green chile paste, 2 teaspoons ground cumin, 2 teaspoons ground coriander, 2 teaspoons paprika, 2 teaspoons salt, 1 teaspoon cayenne pepper, 8 each skewers, ¼ cup vegetable oil for brushing, or as needed",Indian Style Sheekh Kabab,15 mins,4.5,2 hrs 25 mins,https://www.allrecipes.com/recipe/33252/indian-style-sheekh-kabab/,"['lamb', 'onion', 'mint', 'cilantro', 'ginger', 'cumin', 'coriander', 'paprika', 'salt', 'cayenne', 'pepper', 'oil']",veg,"['lamb', 'onion', 'mint', 'cilantro', 'ginger', 'cumin', 'coriander', 'paprika', 'salt', 'cayenne', 'pepper', 'oil']"
257,5 mins,"1. Heat butter in a skillet over medium-high heat. Beat eggs and water together, then pour into pan. Add feta cheese, and cook, stirring occasionally to scramble. Season with salt and pepper.","1 tablespoon butter, 3 eggs, 1 teaspoon water, ½ cup crumbled feta cheese, salt and pepper to taste",Greek Scrambled Eggs,10 mins,4.5,15 mins,https://www.allrecipes.com/recipe/48983/greek-scrambled-eggs/,"['butter', 'egg', 'water', 'feta', 'cheese', 'salt', 'pepper']",non-veg,"['butter', 'egg', 'water', 'feta', 'cheese', 'salt', 'pepper']"
230,,"1. Combine cream cheese, sour cream, salsa, pepper, celery salt, cumin, garlic powder, cilantro and lime juice in a blender or food processor. Blend until smooth and creamy. Place in a serving bowl.","1 (8 ounce) package cream cheese, softened, 1 tablespoon sour cream, 1 (7 ounce) can tomatillo salsa, 1 teaspoon freshly ground black pepper, 1 teaspoon celery salt, ½ teaspoon ground cumin, 2 teaspoons garlic powder, 1 bunch fresh cilantro, chopped, 1 tablespoon fresh lime juice",Amy's Cilantro Cream Sauce,10 mins,4.5,10 mins,https://www.allrecipes.com/recipe/20446/amys-cilantro-cream-sauce/,"['cream', 'cheese', 'cream', 'tomatillo', 'salsa', 'pepper', 'celery', 'salt', 'cumin', 'garlic', 'cilantro', 'lime']",veg,"['cream', 'cheese', 'cream', 'tomatillo', 'salsa', 'pepper', 'celery', 'salt', 'cumin', 'garlic', 'cilantro', 'lime']"
59,30 mins,"1. Place cauliflower pieces through the feeding tube of the food processor using the grating blade; pulse until all the cauliflower is shredded. 2. Place a steamer insert into a saucepan and fill with water to just below the bottom of the steamer. Bring water to a boil. Add cauliflower, cover, and steam until tender, about 15 minutes. Transfer cauliflower to a large bowl and refrigerate, stirring occasionally, until cooled, about 15 minutes. 3. Preheat an oven to 450 degrees F (230 degrees C). Line a baking sheet with parchment paper or a silicon mat. 4. Stir Italian cheese blend, parsley, egg, garlic, salt, and pepper into cauliflower until evenly incorporated. Pour mixture onto the prepared baking sheet; press and shape into a pizza crust. 5. Bake in the preheated oven until lightly browned, about 15 minutes.","½ head cauliflower, coarsely chopped, ½ cup shredded Italian cheese blend, ¼ cup chopped fresh parsley, 1 egg, 1 teaspoon chopped garlic, salt and ground black pepper to taste",Cauliflower Pizza Crust,15 mins,4.5,1 hr,https://www.allrecipes.com/recipe/232930/cauliflower-pizza-crust/,"['cauliflower', 'cheese', 'parsley', 'egg', 'garlic', 'salt', 'pepper']",non-veg,"['cauliflower', 'cheese', 'parsley', 'egg', 'garlic', 'salt', 'pepper']"
228,10 mins,"1. Preheat the oven to 400 degrees F (200 degrees C). Line two baking sheets with parchment paper or silicone mats. 2. Wrap the handle of a wooden spoon with aluminum foil. Balance between two tall cans. 3. Spread Cheddar cheese on the prepared baking sheets into four 6-inch circles placed 2 inches apart. 4. Bake in the preheated oven until cheese melts and is lightly brown, 6 to 8 minutes. Cool for 2 to 3 minutes. Lift with a spatula and drape over the wrapped wooden handle to make a taco shell shape. Cool until set, about 10 minutes.",2 cups shredded Cheddar cheese,Low-Carb Keto Cheese Taco Shells,10 mins,5.0,30 mins,https://www.allrecipes.com/recipe/261028/low-carb-keto-cheese-taco-shells/,"['cheddar', 'cheese']",veg,"['cheddar', 'cheese']"
82,2 mins,"1. Crack egg into a microwave-safe mug; beat until even in color. Pour in milk and beat until light yellow in color. 2. Heat in microwave until cooked through and fluffy, about 90 seconds. Sprinkle pepper over egg.","1 egg, 1 tablespoon milk, 1 pinch ground black pepper (Optional)",Scrambled Eggs in a Mug,5 mins,4.5,7 mins,https://www.allrecipes.com/recipe/257530/scrambled-eggs-in-a-mug/,"['egg', 'milk', 'pepper']",non-veg,"['egg', 'milk', 'pepper']"
157,5 mins,"1. Cut lengthwise slices from zucchini using a vegetable peeler, stopping when the seeds are reached. Turn zucchini over and continue 'peeling' until all the zucchini is in long strips; discard seeds. Slice the zucchini into thinner strips resembling spaghetti. 2. Heat olive oil in a skillet over medium heat; cook and stir zucchini in the hot oil for 1 minute. Add water and cook until zucchini is softened, 5 to 7 minutes. Season with salt and pepper.","2 zucchinis, peeled, 1 tablespoon olive oil, ¼ cup water, salt and ground black pepper to taste",Low-Carb Zucchini Pasta,10 mins,4.5,15 mins,https://www.allrecipes.com/recipe/233453/low-carb-zucchini-pasta/,"['zucchini', 'oil', 'water', 'salt', 'pepper']",veg,"['zucchini', 'oil', 'water', 'salt', 'pepper']"
