calories,cook,directions,ingredients,name,prep,rating,ready in,url,keyword,veg/nonveg,core
513,12 mins,"1. Preheat oven to 350 degrees F (175 degrees C). Grease cookie sheet. 2. Combine peanut butter, eggs, and sugar and mix until smooth. Mix in chocolate chips and nuts, if desired. Spoon dough by tablespoons onto a cookie sheet. 3. Bake for 10 to 12 minutes or until lightly browned. Let the cookies cool on the cookie sheets for 5 to 10 minutes before removing.","2 cups peanut butter, 2 cups white sugar, 4 eggs, beaten, 2 cups semi-sweet chocolate chips (Optional), 1 ½ cups chopped pecans (Optional)",Gluten-Free Peanut Butter Cookies,30 mins,4.5,52 mins,https://www.allrecipes.com/recipe/11441/gluten-free-peanut-butter-cookies/,"['peanut', 'butter', 'sugar', 'egg', 'chocolate', 'chip', 'pecan']",non-veg,"['peanut', 'butter', 'sugar', 'egg', 'chocolate', 'chip', 'pecan']"
179,5 mins,"1. With a large, sharp knife, remove the top 1/4 section of the watermelon. With a melon baller, scoop flesh from inside of watermelon, removing as many seeds as possible. Leave 1/2 inch of flesh inside the shell of the watermelon. Scoop cantaloupe and honeydew in the same manner, removing as much flesh as possible, and discarding the rinds. Refrigerate fruits separately until ready to assemble. 2. In a small saucepan over medium-high heat, bring water and sugar to a boil. Remove from heat, and continue stirring until sugar has completely dissolved. Add lemon zest, and set aside to cool. 3. To serve, place watermelon balls, cantaloupe, honeydew, oranges, pineapple, strawberries, and grapes, in a large mixing bowl. Pour syrup over, and toss thoroughly. Transfer mixture to watermelon bowl, and serve. Set aside any fruit mixture that will not fit. There will be enough fruit to refill the bowl.","1 large watermelon, 1 cantaloupe, halved and seeded, 1 honeydew melon, halved and seeded, 2 (15 ounce) cans mandarin oranges, drained, 2 (20 ounce) cans pineapple chunks, drained, 2 cups halved fresh strawberries, 2 cups seedless grapes, ½ cup water, ¼ cup white sugar, 2 tablespoons grated lemon zest",Watermelon Fruit Bowl,30 mins,4.5,50 mins,https://www.allrecipes.com/recipe/38521/watermelon-fruit-bowl/,"['watermelon', 'cantaloupe', 'honeydew', 'mandarin', 'orange', 'pineapple', 'strawberry', 'grape', 'water', 'sugar', 'lemon']",veg,"['watermelon', 'cantaloupe', 'honeydew', 'mandarin', 'orange', 'pineapple', 'strawberry', 'grape', 'water', 'sugar', 'lemon']"
202,25 mins,"1. Cut kohlrabi into thin noodles using a spiralizer. 2. Heat a large skillet over medium heat. Brown bacon and onion, until bacon is beginning to crisp and onion is caramelized but not burning, 10 to 12 minutes. Transfer bacon and onion to a small bowl, reserving 1 tablespoon bacon grease in the skillet. 3. Add kohlrabi noodles to the skillet and season with salt. Cook noodles over medium heat, stirring occasionally, until they begin to wilt down and soften, 12 to 14 minutes. Stir in butter until melted. Add in bacon and onion mixture and stir in 1/2 the Parmesan cheese. 4. Serve immediately topped with remaining cheese and parsley.","3 kohlrabi bulbs, trimmed and peeled, 4 slices bacon, cut into small pieces, ½ medium yellow onion, sliced, 1 tablespoon olive oil, or as needed (Optional), salt to taste, 2 tablespoons butter, ⅓ cup grated Parmesan cheese, 2 tablespoons minced fresh parsley (Optional)",Kohlrabi Noodles with Bacon and Parmesan,20 mins,5.0,45 mins,https://www.allrecipes.com/recipe/274979/kohlrabi-noodles-with-bacon-and-parmesan/,"['kohlrabi', 'bacon', 'onion', 'oil', 'salt', 'butter', 'parmesan', 'cheese', 'parsley']",veg,"['kohlrabi', 'bacon', 'onion', 'oil', 'salt', 'butter', 'parmesan', 'cheese', 'parsley']"
99,,"1. In a medium bowl, mix together sour cream, mayonnaise, corn, green onions, jalapeno chile peppers, green chile peppers and cheese. Ready to serve!","1 (8 ounce) container sour cream, 1 cup mayonnaise, 2 (11 ounce) cans Mexican-style corn, 4 green onions, chopped, 3 jalapeno peppers, seeded and minced, 1 (7 ounce) can diced green chiles, 1 ¼ cups shredded Cheddar cheese",Spicy Corn Dip,10 mins,4.5,10 mins,https://www.allrecipes.com/recipe/14820/spicy-corn-dip/,"['cream', 'mayonnaise', 'corn', 'onion', 'jalapeno', 'pepper', 'cheddar', 'cheese']",veg,"['cream', 'mayonnaise', 'corn', 'onion', 'jalapeno', 'pepper', 'cheddar', 'cheese']"
174,15 mins,"1. Heat 1 tablespoon of vegetable oil in a wok or large skillet over high heat. Stir in the mushrooms, snow peas, water chestnuts, and bok choy; season to taste with salt and pepper. Cook and stir until the vegetables are just tender, about 5 minutes. Remove the vegetables from the wok and wipe the wok clean. 2. Heat the remaining 1 tablespoon of vegetable oil in the wok. Stir in the garlic and ginger; cook a few seconds until the garlic begins to turn golden brown. Stir in the chicken and cook until the chicken is no longer pink, about 5 minutes. Add the wine, sugar, and chicken broth; bring to a boil. Dissolve the cornstarch in the water and stir into the simmering sauce. Once the sauce returns to a simmer, stir until thick and clear, about 30 seconds. Return the vegetables to the wok and toss until hot and coated with the sauce.","1 tablespoon vegetable oil, ¼ pound sliced fresh mushrooms, ¼ pound snow peas, 1 (8 ounce) can sliced water chestnuts, drained, ¼ pound sliced bok choy, salt and black pepper to taste, 1 tablespoon vegetable oil, 1 teaspoon minced garlic, 1 teaspoon minced fresh ginger root, ¾ cup skinless, boneless chicken breast meat - thinly sliced, 1 teaspoon white wine, ¼ teaspoon white sugar, ¼ cup chicken broth, 1 tablespoon cornstarch, 2 tablespoons water",Moo Goo Gai Pan II,30 mins,4.5,45 mins,https://www.allrecipes.com/recipe/150942/moo-goo-gai-pan-ii/,"['oil', 'mushroom', 'pea', 'water', 'chestnut', 'choy', 'salt', 'pepper', 'oil', 'garlic', 'ginger', 'chicken', 'meat', 'sugar', 'chicken', 'cornstarch', 'water']",non-veg,"['oil', 'mushroom', 'pea', 'water', 'chestnut', 'choy', 'salt', 'pepper', 'oil', 'garlic', 'ginger', 'chicken', 'meat', 'sugar', 'chicken', 'cornstarch', 'water']"
107,56 mins,"1. Preheat oven to 400 degrees F (200 degrees C). Prick each potato a few times with a fork and place on a baking sheet. 2. Bake in the preheated oven until tender when pierced with a knife, about 50 minutes. Cool until easily handled, about 10 minutes. 3. Peel potatoes and pass through a ricer or food mill into a large bowl. Make a well in the mashed potatoes with a wooden spoon and pour in egg; mix well. 4. Whisk potato starch, sweet rice flour, and salt together in a bowl. Sprinkle over potato mixture; stir until a soft dough has formed. Cut dough into 4 equal parts with a knife or pastry cutter. 5. Dust work surface with rice flour to keep dough from sticking. Roll out 1 piece of dough into a rope about 1 inch in diameter. Cut into 1-inch gnocchi. Gently roll each one with the back of a fork to create ridges. Repeat with remaining dough. 6. Shake off any excess rice flour and let gnocchi rest, about 5 minutes. 7. Bring a large pot of salted water to a boil. Add gnocchi in batches and cook, without stirring, until they float to the top, 1 to 2 minutes. Remove with a slotted spoon.","1 ½ pounds potatoes, 1 egg at room temperature, lightly beaten, ⅓ cup potato starch, 1 tablespoon sweet rice flour, ½ teaspoon fine salt, 2 tablespoons rice flour, or as needed",Homemade Gluten-Free Gnocchi,30 mins,4.5,1 hr 41 mins,https://www.allrecipes.com/recipe/246872/homemade-gluten-free-gnocchi/,"['potato', 'egg', 'potato', 'starch', 'rice', 'flour', 'salt', 'rice', 'flour']",non-veg,"['potato', 'egg', 'potato', 'starch', 'rice', 'flour', 'salt', 'rice', 'flour']"
124,20 mins,"1. Spread chickpeas on a double layer of paper towels, cover with another layer of paper towels, and let dry for 30 minutes. 2. Preheat air fryer to 355 degrees F (180 degrees C). 3. Combine dry chickpeas, nutritional yeast, olive oil, smoked paprika, garlic, salt, and cumin in a bowl; toss to coat. 4. Add chickpeas to the air fryer and cook until crispy, 20 to 22 minutes, shaking them every 4 minutes.","1 (15 ounce) can chickpeas, rinsed and drained, 1 tablespoon nutritional yeast, 1 tablespoon olive oil, 1 teaspoon smoked paprika, 1 teaspoon granulated garlic, ½ teaspoon salt, 1 pinch cumin",Spiced Air-Fried Chickpeas,5 mins,5.0,55 mins,https://www.allrecipes.com/recipe/264820/spiced-air-fried-chickpeas/,"['chickpea', 'yeast', 'oil', 'paprika', 'garlic', 'salt', 'cumin']",veg,"['chickpea', 'yeast', 'oil', 'paprika', 'garlic', 'salt', 'cumin']"
31,17 mins,"1. Preheat oven to 300 degrees F (150 degrees C). Line a baking sheet with parchment paper. 2. Place cream cheese in a microwave-safe bowl and warm in the microwave at 10-second intervals until softened, about 30 seconds. Cool to room temperature, about 5 minutes. Mix in egg yolks until smooth. 3. Place egg whites and baking powder in a glass, metal, or ceramic bowl; beat together until stiff peaks form. 4. Fold yolk mixture gently into egg whites until batter is just combined and light yellow in color. 5. Scoop batter into 4-inch rounds on baking sheet, flattening peaks with the back of the spoon. 6. Bake in the preheated oven until golden brown, 17 to 20 minutes.","2 tablespoons cream cheese, 2 eggs, separated, ¼ teaspoon baking powder",Cloud Bread,10 mins,4.5,32 mins,https://www.allrecipes.com/recipe/246248/cloud-bread/,"['cream', 'cheese', 'egg']",non-veg,"['cream', 'cheese', 'egg']"
101,34 mins,"1. Preheat oven to 425 degrees F (220 degrees C). Line a muffin tin with parchment paper squares. 2. Grate cauliflower into a microwave-safe bowl using a fine grater. Chop up any remaining pieces that are too small to grate but too big for the crust. 3. Microwave cauliflower until soft and tender, 4 to 6 minutes. Pour cauliflower into a clean dish towel cool easily handled, 15 to 20 minutes. 4. Wrap the towel around the cauliflower and squeeze out as much liquid as possible; the drier the cauliflower is, the better it will hold together as a crust once mixed with the other ingredients. 5. Combine cauliflower, 1 cup mozzarella cheese, Parmesan cheese, egg, salt, pepper, garlic powder, and onion powder in a large bowl. 6. Scoop cauliflower crust mixture into prepared muffin tin, dividing the mixture evenly among the cups. Pat down cauliflower mixture with the back of a spoon, making it compact. 7. Bake in the preheated oven until golden brown, about 15 minutes. 8. Spoon a small amount of pizza sauce onto each cauliflower crust. Top with remaining 1 1/2 cups mozzarella cheese, dividing evenly among the crusts. 9. Bake until golden brown and cheese is melted, about 15 minutes. Let sit in pan for 5 minutes before moving each bite to a cooling rack. Let cool for 10 minutes. Peel parchment paper squares off the crusts and serve on a platter.","1 large head cauliflower, cut into large chunks, 2 ½ cups shredded mozzarella cheese, divided, ½ cup freshly grated Parmesan cheese, 1 egg, ¼ teaspoon salt, ¼ teaspoon ground black pepper, ¼ teaspoon garlic powder, ¼ teaspoon onion powder, ⅓ cup pizza sauce",Cauliflower Pizza Bites,30 mins,4.5,1 hr 34 mins,https://www.allrecipes.com/recipe/260696/cauliflower-pizza-bites/,"['cauliflower', 'mozzarella', 'cheese', 'parmesan', 'cheese', 'egg', 'salt', 'pepper', 'garlic', 'onion', 'sauce']",non-veg,"['cauliflower', 'mozzarella', 'cheese', 'parmesan', 'cheese', 'egg', 'salt', 'pepper', 'garlic', 'onion', 'sauce']"
59,,"1. Beat cream cheese and butter together in a large bowl until smooth. Add confectioners' sugar and vanilla; beat until smooth. Mix in flaked coconut. 2. Roll mixture into balls or potato shapes; roll balls in cinnamon. Place onto a cookie sheet and chill to set, at least 10 minutes. If desired, roll potatoes in cinnamon again for a darker color.","½ (8 ounce) package cream cheese, ¼ cup butter, softened, 4 cups confectioners' sugar, 1 teaspoon vanilla extract, 2 ½ cups flaked coconut, 1 tablespoon ground cinnamon",Irish Potato Candy,20 mins,4.5,30 mins,https://www.allrecipes.com/recipe/16520/irish-potato-candy/,"['cream', 'cheese', 'butter', 'sugar', 'vanilla', 'coconut', 'cinnamon']",veg,"['cream', 'cheese', 'butter', 'sugar', 'vanilla', 'coconut', 'cinnamon']"
173,12 mins,"1. Preheat oven to 350 degrees F (175 degrees C). Line a baking sheet with parchment paper. 2. Combine almond butter, eggs, sweetener, cocoa powder, vanilla extract, and salt in the bowl of a food processor; pulse until a dough forms. 3. Roll dough into 1-inch balls. Place on the prepared baking sheet and press down twice with a fork in a criss-cross pattern. 4. Bake in the preheated oven until edges are firm, about 12 minutes. Cool on the baking sheet for 1 minute before removing to a wire rack to cool completely.","1 ½ cups almond butter, 2 eggs, ½ cup low-calorie natural sweetener (such as Swerve®), ⅓ cup unsweetened cocoa powder, sifted, 1 teaspoon sugar-free vanilla extract, 1 pinch salt",Chewy Keto Chocolate Cookies,10 mins,2.5,23 mins,https://www.allrecipes.com/recipe/261183/chewy-keto-chocolate-cookies/,"['almond', 'butter', 'egg', 'cocoa', 'vanilla', 'salt']",non-veg,"['almond', 'butter', 'egg', 'cocoa', 'vanilla', 'salt']"
324,1 hr,"1. Beat milk and egg together in a large bowl. Mix bread crumbs in until a paste forms. Add ground beef, onion, garlic, and parsley, and mix with your hands until just combined. 2. Preheat the oven to 350 degrees F (175 degrees C). Coat a baking sheet with cooking spray. 3. Measure meatballs using an ice cream scoop. Roll balls with dampened hands and place on the prepared baking sheet 4. Bake in the preheated oven until meatballs are no longer pink in the center and an instant-read thermometer inserted into the center should read at least 160 degrees F (70 degrees C), about 30 minutes. 5. While meatballs bake, heat tomato sauce in saucepan over medium heat. 6. Add baked meatballs to the sauce and simmer, uncovered, for 30 minutes.","½ cup milk, 1 egg, 1 cup gluten-free Italian bread crumbs, 1 ½ pounds ground beef, ¼ onion, minced, 1 clove garlic, minced (Optional), 1 sprig fresh parsley, chopped, cooking spray, 1 (28 ounce) jar tomato sauce, or as needed",Gluten-Free Italian Meatballs,20 mins,4.0,1 hr 20 mins,https://www.allrecipes.com/recipe/268255/gluten-free-italian-meatballs/,"['milk', 'egg', 'bread', 'beef', 'onion', 'clove', 'garlic', 'parsley', 'tomato', 'sauce']",non-veg,"['milk', 'egg', 'bread', 'beef', 'onion', 'clove', 'garlic', 'parsley', 'tomato', 'sauce']"
242,,"1. Place ingredients in the pan of the bread machine in the order recommended by the manufacturer. 2. Select the sweet dough cycle. Five minutes into the cycle, check the consistency of the dough. Add additional rice flour or liquid if necessary. 3. When bread is finished, let cool for 10 to 15 minutes before removing from pan.","3 eggs, 1 tablespoon cider vinegar, ¼ cup olive oil, ¼ cup honey, 1 ½ cups buttermilk, at room temperature, 1 teaspoon salt, 1 tablespoon xanthan gum, ⅓ cup cornstarch, ½ cup potato starch, ½ cup soy flour, 2 cups white rice flour, 1 tablespoon active dry yeast",Gluten-Free White Bread for Bread Machines,,4.5,,https://www.allrecipes.com/recipe/7185/gluten-free-white-bread-for-bread-machines/,"['egg', 'vinegar', 'oil', 'honey', 'buttermilk', 'salt', 'cornstarch', 'potato', 'starch', 'soy', 'flour', 'rice', 'flour', 'yeast']",non-veg,"['egg', 'vinegar', 'oil', 'honey', 'buttermilk', 'salt', 'cornstarch', 'potato', 'starch', 'soy', 'flour', 'rice', 'flour', 'yeast']"
78,25 mins,"1. Heat oil in a large skillet or wok over medium heat. Add sesame seeds. When seeds start to darken, stir in green beans. Cook, stirring, until the beans turn bright green. 2. Pour in chicken broth, salt and pepper. Cover and cook until beans are tender-crisp, about 10 minutes. Uncover and cook until liquid evaporates.","1 tablespoon olive oil, 1 tablespoon sesame seeds, 1 pound fresh green beans, cut into 2 inch pieces, ¼ cup chicken broth, ¼ teaspoon salt, freshly ground black pepper to taste",Sesame Green Beans,5 mins,4.5,30 mins,https://www.allrecipes.com/recipe/25246/sesame-green-beans/,"['oil', 'bean', 'chicken', 'salt', 'pepper']",non-veg,"['oil', 'bean', 'chicken', 'salt', 'pepper']"
74,5 mins,"1. Heat a non-stick skillet over medium heat. Place capsicum ring in the hot skillet. Crack egg into capsicum ring; cook until bottom holds together and corners are browned, 2 to 3 minutes. Flip and cook until desired doneness is reached, 2 to 3 minutes more; season with salt and ground black pepper.","1 large egg, 1 (1/4 inch thick) ring capsicum, salt and ground black pepper to taste",Egg in a Pepper,5 mins,4.5,10 mins,https://www.allrecipes.com/recipe/244281/egg-in-a-pepper/,"['egg', 'capsicum', 'salt', 'pepper']",non-veg,"['egg', 'pepper', 'salt', 'pepper']"
146,15 mins,"1. Generously grease a large slab or baking sheet. 2. In a saucepan over medium heat, combine brown sugar, white sugar and milk. Bring to a boil. Stir in butter, pecans and vanilla. Heat, without stirring, to between 234 and 240 degrees F (112 to 116 degrees C), or until a small amount of syrup dropped into cold water forms a soft ball that flattens when removed from the water and placed on a flat surface. Remove from heat and let cool 5 minutes. 3. Beat until thickened, then pour immediately onto prepared surface and let rest until firm and completely cool before cutting.","1 cup brown sugar, 1 cup white sugar, ½ cup evaporated milk, 2 tablespoons butter, 1 ¼ cups pecan halves, ¼ teaspoon vanilla extract",Yummy Pecan Pralines,15 mins,4.5,1 hr 30 mins,https://www.allrecipes.com/recipe/24565/yummy-pecan-pralines/,"['sugar', 'sugar', 'milk', 'butter', 'pecan', 'vanilla']",veg,"['sugar', 'sugar', 'milk', 'butter', 'pecan', 'vanilla']"
107,30 mins,"1. Preheat oven to 350 degrees F (175 degrees C). Grease a shallow baking dish. 2. Scoop out the flesh of the zucchini; chop the flesh and set aside. Place the shells in the prepared dish. 3. Heat oil in a large skillet over medium heat. Saute onions for 5 minutes, then add garlic and saute 2 minutes more. Stir in chopped zucchini and mushrooms; saute 5 minutes. Stir in coriander, cumin, chickpeas, lemon juice, parsley, salt and pepper. Spoon mixture into zucchini shells. 4. Bake in preheated oven for 30 to 40 minutes, or until zucchini are tender.","4 zucchini, halved, 1 tablespoon olive oil, 1 onion, chopped, 2 cloves garlic, crushed, ½ (8 ounce) package button mushrooms, sliced, 1 teaspoon ground coriander, 1 ½ teaspoons ground cumin, or to taste, 1 (15.5 ounce) can chickpeas, rinsed and drained, ½ lemon, juiced, 2 tablespoons chopped fresh parsley, sea salt to taste, ground black pepper to taste",Zucchini with Chickpea and Mushroom Stuffing,30 mins,4.0,1 hr,https://www.allrecipes.com/recipe/25920/zucchini-with-chickpea-and-mushroom-stuffing/,"['zucchini', 'oil', 'onion', 'clove', 'garlic', 'mushroom', 'coriander', 'cumin', 'chickpea', 'lemon', 'parsley', 'salt', 'pepper']",veg,"['zucchini', 'oil', 'onion', 'clove', 'garlic', 'mushroom', 'coriander', 'cumin', 'chickpea', 'lemon', 'parsley', 'salt', 'pepper']"
54,4 hrs,"1. Prick outside of squash 10 to 15 times and place in a slow cooker crock. Pour water into crock. 2. Cook on Low 4 to 6 hours. Remove squash to a cutting board until cool to the touch, 15 to 30 minutes. 3. Halve the squash lengthwise. Scoop seeds from the cavity and discard them. Shred flesh from the skin with a fork to make strands.","1 whole spaghetti squash, washed thoroughly, 1 ½ cups water",Slow Cooker Spaghetti Squash,5 mins,4.5,4 hrs 20 mins,https://www.allrecipes.com/recipe/240068/slow-cooker-spaghetti-squash/,"['squash', 'water']",veg,"['squash', 'water']"
180,10 mins,"1. Process berries in a blender or food processor until smooth. Strain mixture into a small bowl, and discard seeds. Add the sugar and liqueur, and stir until sugar dissolves. Makes 1 cup of sauce. 2. In a heavy saucepan on low heat, warm 1/4 cup of the cream and the white chocolate, stirring constantly until chocolate melts. Let mixture cool until it is lukewarm. Stir in 1 tablespoon of raspberry sauce, and the food coloring. Transfer to a large bowl. 3. In a medium bowl, whip remaining 1 1/2 cup cream to soft peaks. Fold into melted chocolate mixture, one-third at a time, until no streaks remain. 4. Layer into parfait dishes, and serve with the sauce. May also be used to fill or ice a cake.","1 (10 ounce) package frozen raspberries, thawed, 2 tablespoons white sugar, 2 tablespoons orange liqueur, 1 ¾ cups heavy whipping cream, 6 ounces white chocolate, chopped, 1 drop red food coloring",Raspberry White Chocolate Mousse,15 mins,4.5,40 mins,https://www.allrecipes.com/recipe/8271/raspberry-white-chocolate-mousse/,"['raspberry', 'sugar', 'orange', 'liqueur', 'cream', 'chocolate']",veg,"['raspberry', 'sugar', 'orange', 'liqueur', 'cream', 'chocolate']"
40,15 mins,"1. Mix red onion, yellow onion, salt, jalapeno, garlic, coriander, chili powder, turmeric, and cumin in a large bowl. Stir until evenly combined. Add chickpea flour and water. Stir to combine into a thick batter. Add more water if necessary. Let mixture rest for 10 minutes. 2. Preheat air fryer to 350 degrees F (175 degrees C). 3. Spray the air fryer basket with nonstick cooking spray. Spoon 2 tablespoons of batter into the basket and flatten. Repeat as many times as your basket allows without the bhajis touching. 4. Cook in the preheated air fryer for 6 minutes. Mist the tops of each bhaji with cooking spray. Flip and cook 6 additional minutes. Transfer to a paper towel-lined plate. Repeat with remaining batter.","1 small red onion, thinly sliced, 1 small yellow onion, thinly sliced, 1 tablespoon salt, 1 jalapeno pepper, seeded and minced, 1 clove garlic, minced, 1 teaspoon coriander, 1 teaspoon chili powder, 1 teaspoon ground turmeric, ½ teaspoon cumin, ⅔ cup chickpea flour (besan), 4 tablespoons water, or as needed, cooking spray",Air Fryer Onion Bhaji,10 mins,3.5,35 mins,https://www.allrecipes.com/recipe/270820/air-fryer-onion-bhaji/,"['onion', 'onion', 'salt', 'jalapeno', 'pepper', 'clove', 'garlic', 'coriander', 'chili', 'turmeric', 'cumin', 'chickpea', 'flour', 'water']",veg,"['onion', 'onion', 'salt', 'jalapeno', 'pepper', 'clove', 'garlic', 'coriander', 'chili', 'turmeric', 'cumin', 'chickpea', 'flour', 'water']"
119,,"1. Preheat oven to 300 degrees F (150 degrees C). To prevent burning you can bake on an air cushion baking sheet or put parchment paper on a regular cookie sheet. 2. Beat egg whites, salt, cream of tartar, and vanilla until very firm. Gradually add sugar and mix. Fold in chocolate chips. 3. Drop by teaspoonfuls on pan. Bake 300 degrees for 25 minutes. They should only be lightly browned.","2 egg whites, ⅛ teaspoon salt, ⅛ teaspoon cream of tartar, 1 teaspoon vanilla extract, ¾ cup white sugar, 1 cup semisweet chocolate chips",Meringue Cookies,,4.0,,https://www.allrecipes.com/recipe/9847/meringue-cookies/,"['egg', 'salt', 'cream', 'vanilla', 'sugar', 'chocolate', 'chip']",non-veg,"['egg', 'salt', 'cream', 'vanilla', 'sugar', 'chocolate', 'chip']"
152,2 hrs,"1. Combine the water, ham hock, and lard in a large pot over medium-high heat. Season with seasoning salt, salt, pepper, garlic powder, and onion powder. Bring to a boil, then reduce heat to medium-low, and add green beans. Simmer covered for about 2 hours.","6 cups water, 1 ham hock, 2 tablespoons lard or other cooking fat, 1 teaspoon seasoning salt, ½ teaspoon salt, ½ teaspoon black pepper, ½ teaspoon garlic powder, ½ teaspoon onion powder, 1 pound fresh green beans - rinsed, trimmed and snapped into bite size pieces",Down-South Style Green Beans,1 hr,4.5,3 hrs,https://www.allrecipes.com/recipe/57337/down-south-style-green-beans/,"['water', 'ham', 'lard', 'salt', 'salt', 'pepper', 'garlic', 'onion', 'bean']",veg,"['water', 'ham', 'lard', 'salt', 'salt', 'pepper', 'garlic', 'onion', 'bean']"
317,5 mins,"1. Bring a large pot of salted water to a boil. Blanch asparagus just until tender, about 1 minute. Plunge into a bowl of cold water to cool. Drain asparagus and place in a large resealable plastic bag. Pour in vinaigrette and seal bag. Refrigerate at least 3 hours, turning bag occasionally. 2. Just before serving, drain asparagus, reserving vinaigrette. Arrange on a serving platter and sprinkle with lemon zest, parsley, salt, and pepper. Serve reserved vinaigrette in a small dish on the side.","2 pounds fresh asparagus, trimmed and cut into 2 1/2 inch pieces, 1 ½ cups balsamic vinaigrette salad dressing, 2 teaspoons grated lemon zest, ¼ cup chopped fresh parsley, ½ teaspoon kosher salt, ½ teaspoon freshly ground black pepper",Zesty Marinated Asparagus,30 mins,4.5,3 hrs,https://www.allrecipes.com/recipe/18414/zesty-marinated-asparagus/,"['asparagus', 'lemon', 'parsley', 'salt', 'pepper']",veg,"['asparagus', 'lemon', 'parsley', 'salt', 'pepper']"
