calories,cook,directions,ingredients,name,prep,rating,ready in,url,keyword,veg/nonveg,core
521,45 mins,"1. Preheat oven to 375 degrees F (190 degrees C). Grease a 9x13-inch baking dish. 2. Bring a large pot of lightly salted water to a boil. Cook elbow macaroni in the boiling water, stirring occasionally until cooked through but firm to the bite, 8 minutes. Drain. 3. Melt 1/4 cup butter in a saucepan over medium heat. Stir salt and mustard powder into melted butter and remove saucepan from heat. 4. Whisk milk and cornstarch together in a bowl until smooth; stir into butter mixture until well blended. Return saucepan to stove; cook milk mixture, stirring constantly, over medium heat until sauce is thickened, about 5 minutes. Remove saucepan from heat. 5. Stir 3 cups Cheddar cheese into sauce until heat from sauce melts cheese. Add pasta to cheese sauce and stir well; pour into the prepared baking dish. 6. Combine remaining 1 cup Cheddar cheese, gluten-free bread crumbs, 1 teaspoon butter, and paprika in a bowl; sprinkle over pasta mixture. 7. Bake in the preheated oven until top is crunchy, about 30 minutes.","10 ounces gluten-free elbow pasta, ¼ cup butter (Optional), 1 ¼ teaspoons salt, ¾ teaspoon mustard powder, 4 cups milk, ¼ cup cornstarch, 4 cups shredded Cheddar cheese, divided, 2 gluten-free bread slices, toasted and broken into crumbs (Optional), 1 teaspoon butter, softened (Optional), ½ teaspoon paprika (Optional)",Easy Gluten-Free Macaroni and Cheese,15 mins,4.5,1 hr,https://www.allrecipes.com/recipe/242268/easy-gluten-free-macaroni-and-cheese/,"['pasta', 'butter', 'salt', 'mustard', 'milk', 'cornstarch', 'cheddar', 'cheese', 'bread', 'butter', 'paprika']",veg,"['pasta', 'butter', 'salt', 'mustard', 'milk', 'cornstarch', 'cheddar', 'cheese', 'bread', 'butter', 'paprika']"
301,9 mins,"1. Heat olive oil in a large skillet over medium heat. Add turkey breast, green pepper, garlic, Italian seasoning, ground black pepper, salt, and red pepper flakes; cook and stir until turkey is lightly browned, 4 to 5 minutes. 2. Stir marinara sauce and baby spinach into the turkey mixture; cook and stir until marinara sauce is warm through, about 3 minutes. 3. Stir zucchini noodles into the sauce with tongs; cook and stir until the zucchini is slightly tender, 2 to 3 minutes.","1 teaspoon extra-virgin olive oil, 1 ¼ pounds ground turkey breast, 1 cup diced green capsicum, 1 tablespoon minced garlic, 2 teaspoons Italian seasoning, ½ teaspoon ground black pepper, ¼ teaspoon salt, ¼ teaspoon red pepper flakes, 3 cups marinara sauce, 2 cups baby spinach leaves, 4 zucchini, cut into noodle-shape strands",Turkey Spaghetti Zoodles,15 mins,5.0,24 mins,https://www.allrecipes.com/recipe/254340/turkey-spaghetti-zoodles/,"['oil', 'turkey', 'capsicum', 'garlic', 'pepper', 'salt', 'pepper', 'sauce', 'spinach', 'zucchini']",non-veg,"['oil', 'turkey', 'pepper', 'garlic', 'pepper', 'salt', 'pepper', 'sauce', 'spinach', 'zucchini']"
235,5 mins,"1. Preheat a waffle iron according to manufacturer's instructions. Grease with cooking spray. 2. Combine oats and almond milk in a large bowl. 3. Whisk egg yolk and butter together in a small bowl; stir into oat mixture. 4. Beat egg white in a glass, metal, or ceramic bowl until stiff peaks form. 5. Stir brown sugar and baking powder into the oat mixture. Fold beaten egg white gently into the batter. 6. Scoop 1/2 cup batter onto the preheated iron and spread to the edges. Close iron and cook until iron stops steaming, about 5 minutes. Repeat with remaining batter.","cooking spray, 1 ½ cups gluten-free rolled oats, ¾ cup almond milk, 1 egg, at room temperature, separated, 3 tablespoons melted butter, 1 tablespoon brown sugar, 1 teaspoon baking powder",Cathy's Gluten-Free Oatmeal Waffles,15 mins,4.0,20 mins,https://www.allrecipes.com/recipe/256559/cathys-gluten-free-oatmeal-waffles/,"['oat', 'almond', 'milk', 'egg', 'butter', 'sugar']",non-veg,"['oat', 'almond', 'milk', 'egg', 'butter', 'sugar']"
350,12 mins,"1. Place salmon fillets on a baking sheet and season with salt and black pepper. 2. Combine pecans, maple syrup, vinegar, paprika, chipotle powder, and onion powder in a food processor; pulse until texture is crumbly. Spoon pecan mixture on top of each salmon fillet, coating the entire top surface. Refrigerate coated salmon, uncovered, for 2 to 3 hours. 3. Preheat oven to 425 degrees F (220 degrees C). 4. Bake salmon in the preheated oven until fish flakes easily with a fork, 12 to 14 minutes.","4 (4 ounce) fillets salmon, salt and ground black pepper to taste, ½ cup pecans, 3 tablespoons pure maple syrup, 1 tablespoon apple cider vinegar, 1 teaspoon smoked paprika, ½ teaspoon chipotle pepper powder, ½ teaspoon onion powder",Paleo Pecan-Maple Salmon,15 mins,4.5,2 hrs 27 mins,https://www.allrecipes.com/recipe/244507/paleo-pecan-maple-salmon/,"['salmon', 'salt', 'pepper', 'pecan', 'maple', 'syrup', 'apple', 'vinegar', 'paprika', 'chipotle', 'pepper', 'onion']",non-veg,"['salmon', 'salt', 'pepper', 'pecan', 'maple', 'syrup', 'apple', 'vinegar', 'paprika', 'chipotle', 'pepper', 'onion']"
221,22 mins,"1. Preheat oven to 350 degrees F (175 degrees C). Grease 12 muffin cups or line with paper liners. 2. Mix water and chia seeds together in a small bowl; set aside until chia seed gel is thickened, about 10 minutes. 3. Combine flour, coconut sugar, baking soda, baking powder, and salt together in a bowl. Whisk chia gel, yogurt, oil, egg, and vanilla extract together in a separate bowl; stir into flour mixture just until batter is moistened. Fold bananas and walnuts into batter. Fill muffin cups 2/3-full with batter. 4. Bake in the preheated oven until a toothpick inserted in the center comes out clean, 22 to 25 minutes. Cool muffins for 5 minutes in the tin before transferring to a wire rack to cool completely.","⅓ cup water, 1 tablespoon chia seeds, 1 ¾ cups gluten-free all purpose baking flour, ¾ cup coconut sugar, 1 teaspoon baking soda, 1 teaspoon baking powder, ½ teaspoon salt, ½ cup plain fat-free yogurt, ¼ cup vegetable oil, 1 large egg, 1 teaspoon vanilla extract, 1 cup mashed ripe bananas, ¾ cup chopped walnuts",Gluten-Free Banana Walnut Chia Muffins,15 mins,5.0,52 mins,https://www.allrecipes.com/recipe/244279/gluten-free-banana-walnut-chia-muffins/,"['water', 'chia', 'flour', 'coconut', 'sugar', 'soda', 'salt', 'yogurt', 'oil', 'egg', 'vanilla', 'banana', 'walnut']",non-veg,"['water', 'chia', 'flour', 'coconut', 'sugar', 'soda', 'salt', 'yogurt', 'oil', 'egg', 'vanilla', 'banana', 'walnut']"
1632,25 mins,"1. Whisk water and sugar together in a bowl. Whisk in yeast. Let stand until yeast softens and begins to form a creamy foam, about 10 minutes. 2. Preheat oven to 425 degrees F (220 degrees C). Line a baking sheet with parchment paper. 3. Combine gluten-free flour, rice flour, Italian seasoning, xanthan gum, gelatin, and salt in the bowl of a stand mixer fitted with the paddle attachment. Whisk vinegar and olive oil into the yeast mixture; pour over flour mixture. Mix on high speed until a wet, sticky dough forms, about 6 minutes. 4. Transfer dough to the prepared baking sheet. Lay another sheet of parchment paper on top; smooth out dough to fill the baking sheet. Let dough rest, about 10 minutes. 5. Bake in the preheated oven until dough puffs up, 5 to 10 minutes. Peel parchment paper off the top. Continue baking until dough is golden brown and edges are cooked through, about 20 minutes.","1 cup very warm water, ½ teaspoon white sugar, 2 teaspoons yeast, 2 cups gluten-free flour blend, ½ cup rice flour, 1 tablespoon Italian seasoning, 1 teaspoon xanthan gum, 1 teaspoon unflavored gelatin powder, ½ teaspoon salt, 3 tablespoons apple cider vinegar, 3 tablespoons olive oil",Gluten-Free Pizza Crust or Flatbread,15 mins,5.0,1 hr,https://www.allrecipes.com/recipe/257436/gluten-free-pizza-crust-or-flatbread/,"['water', 'sugar', 'yeast', 'flour', 'rice', 'flour', 'salt', 'apple', 'vinegar', 'oil']",veg,"['water', 'sugar', 'yeast', 'flour', 'rice', 'flour', 'salt', 'apple', 'vinegar', 'oil']"
215,30 mins,"1. Preheat oven to 350 degrees F (175 degrees C). 2. Mix almond flour, agave nectar, walnuts, eggs, cocoa powder, coconut oil, and vanilla extract together in a bowl; spread into an 8-inch square baking dish. 3. Bake in the preheated oven until edges of brownies begin to pull from sides of dish, about 30 minutes. Let brownies cool slightly before slicing, about 5 minutes.","¾ cup blanched almond flour, ⅔ cup agave nectar, ½ cup chopped walnuts (Optional), 2 eggs, 5 tablespoons unsweetened cocoa powder, ¼ cup coconut oil, 1 teaspoon vanilla extract",Almond Flour Brownies,10 mins,4.5,45 mins,https://www.allrecipes.com/recipe/242209/almond-flour-brownies/,"['almond', 'flour', 'walnut', 'egg', 'cocoa', 'coconut', 'oil', 'vanilla']",non-veg,"['almond', 'flour', 'walnut', 'egg', 'cocoa', 'coconut', 'oil', 'vanilla']"
481,3 hrs 5 mins,"1. Season lamb shanks with salt and pepper. 2. Heat oil in a large, heavy pot or Dutch oven over medium-high heat. Working in batches, cook shanks until brown on all sides, about 8 minutes. Transfer shanks to a plate; set aside. 3. Add carrots, onions, and garlic to the pot and sauté over medium heat until golden brown, about 10 minutes. Stir in wine, tomatoes, chicken broth, beef broth, rosemary, and thyme. 4. Return shanks to the pot, pressing down to submerge. Bring to a boil, then reduce heat to medium-low. Cover and simmer until meat is tender, about 2 hours. 5. Remove the lid and simmer to allow flavors to concentrate, about 20 minutes. Transfer shanks to a platter; cover with foil to keep warm. Continue boiling sauce until thickened, about 15 minutes. Spoon sauce over shanks before serving.","6 lamb shanks, salt and pepper to taste, 2 tablespoons olive oil, 3 large carrots, cut into 1/4 inch rounds, 2 onions, chopped, 10 cloves garlic, minced, 1 (750 milliliter) bottle red wine, 1 (28 ounce) can whole peeled tomatoes with juice, 1 (10.5 ounce) can condensed chicken broth, 1 (10.5 ounce) can beef broth, 5 teaspoons chopped fresh rosemary, 2 teaspoons chopped fresh thyme",Rosemary Braised Lamb Shanks,20 mins,4.5,3 hrs 25 mins,https://www.allrecipes.com/recipe/36927/rosemary-braised-lamb-shanks/,"['lamb', 'salt', 'pepper', 'oil', 'carrot', 'onion', 'clove', 'garlic', 'tomato', 'chicken', 'beef', 'rosemary', 'thyme']",non-veg,"['lamb', 'salt', 'pepper', 'oil', 'carrot', 'onion', 'clove', 'garlic', 'tomato', 'chicken', 'beef', 'rosemary', 'thyme']"
409,40 mins,"1. Preheat oven to 350 degrees F (175 degrees C). Line a 9x13-inch glass baking dish with parchment paper. 2. Mix sugar and eggs together in a bowl until smooth; stir in peanut butter until well blended. Pour peanut butter mixture into the prepared baking dish. 3. Bake in the preheated oven until cookie base is partly cooked, 8 minutes. 4. Layer semisweet chocolate chips, dark chocolate chips, pecans, almonds, and coconut onto the cookie base. Slowly pour sweetened condensed milk evenly over the toppings. 5. Bake in the preheated oven until coconut is slightly brown, about 30 minutes. 6. Cool completely before removing cookie bars from pan. Peel away parchment paper and cut into small squares using a sharp knife.","2 cups white sugar, 2 large eggs, 2 cups peanut butter, ¾ cup semisweet chocolate chips, ¾ cup dark chocolate chips, ½ cup chopped raw pecans, ½ cup chopped raw almonds, 1 cup flaked coconut, 1 (14 ounce) can sweetened condensed milk",(Gluten Free) Magic Cookie Bars,15 mins,4.5,1 hr 55 mins,https://www.allrecipes.com/recipe/230558/gluten-free-magic-cookie-bars/,"['sugar', 'egg', 'peanut', 'butter', 'chocolate', 'chip', 'chocolate', 'chip', 'pecan', 'almond', 'coconut', 'milk']",non-veg,"['sugar', 'egg', 'peanut', 'butter', 'chocolate', 'chip', 'chocolate', 'chip', 'pecan', 'almond', 'coconut', 'milk']"
248,1 hr 25 mins,"1. Preheat the oven to 350 degrees F (175 degrees C). 2. Bring water and rice to a boil in a covered saucepan. Reduce heat to low and simmer until rice is tender, about 20 minutes. 3. Meanwhile, heat oil in a skillet over medium heat. Add ground beef and cook until evenly browned and crumbly, 7 to 9 minutes. 4. Hollow out capsicums by removing and discarding the tops, seeds, and membranes. Slice the bottoms of the peppers if necessary to make sure they stand up straight. 5. Arrange peppers in a baking dish with the hollowed sides facing upward. 6. Prepare filling by mixing cooked beef, cooked rice, 1/2 of the tomato sauce, Worcestershire sauce, garlic powder, onion powder, salt, and pepper. Spoon an equal amount of filling into each hollowed pepper. 7. Mix remaining tomato sauce and Italian seasoning in a bowl, and pour over the stuffed peppers. 8. Bake in the preheated oven, basting with sauce every 15 minutes, until peppers are tender, about 1 hour.","1 cup cold water, ½ cup uncooked long grain white rice, 1 tablespoon vegetable oil, 1 pound ground beef, 6 medium green capsicums, 16 ounces tomato sauce, divided, 1 tablespoon Worcestershire sauce, ¼ teaspoon garlic powder, ¼ teaspoon onion powder, salt and ground black pepper to taste, 1 teaspoon Italian seasoning",Stuffed Peppers,5 mins,4.5,1 hr 30 mins,https://www.allrecipes.com/recipe/16330/stuffed-peppers/,"['water', 'rice', 'oil', 'beef', 'capsicum', 'tomato', 'sauce', 'worcestershire', 'sauce', 'garlic', 'onion', 'salt', 'pepper']",non-veg,"['water', 'rice', 'oil', 'beef', 'pepper', 'tomato', 'sauce', 'worcestershire', 'sauce', 'garlic', 'onion', 'salt', 'pepper']"
423,1 hr 15 mins,"1. Preheat oven to 350 degrees F (175 degrees C). 2. Place chicken in a roasting pan, and season generously inside and out with salt and pepper. Sprinkle inside and out with onion powder. Place 3 tablespoons margarine in the chicken cavity. Arrange dollops of the remaining margarine around the chicken's exterior. Cut the celery into 3 or 4 pieces, and place in the chicken cavity. 3. Bake chicken uncovered in the preheated oven until no longer pink at the bone and the juices run clear, about 1 hour and 15 minutes. An instant-read thermometer inserted into the thickest part of the thigh, near the bone, should read 180 degrees F (82 degrees C). Remove from heat and baste with melted margarine and drippings. Cover with aluminum foil and allow to rest about 30 minutes before serving.","1 (3 pound) whole chicken, giblets removed, salt and black pepper to taste, 1 tablespoon onion powder, or to taste, ½ cup margarine, divided, 1 stalk celery, leaves removed",Juicy Roasted Chicken,10 mins,4.5,1 hr 40 mins,https://www.allrecipes.com/recipe/83557/juicy-roasted-chicken/,"['chicken', 'salt', 'pepper', 'onion', 'margarine', 'celery']",non-veg,"['chicken', 'salt', 'pepper', 'onion', 'margarine', 'celery']"
240,10 mins,"1. Whisk together almond flour, water, eggs, maple syrup, and salt in a large bowl until smooth. 2. Heat oil on a griddle over medium heat. 3. Drop batter by large spoonfuls onto the griddle. Cook until bubbles form and edges are dry, 3 to 5 minutes. Flip and cook until bottoms are browned, 3 to 5 minutes. Repeat with remaining batter.","1 cup almond flour, ¼ cup water, 2 eggs, 1 tablespoon maple syrup, ¼ teaspoon salt, 1 teaspoon oil, or as needed",Quick Almond Flour Pancakes,10 mins,4.0,20 mins,https://www.allrecipes.com/recipe/234702/quick-almond-flour-pancakes/,"['almond', 'flour', 'water', 'egg', 'maple', 'syrup', 'salt', 'oil']",non-veg,"['almond', 'flour', 'water', 'egg', 'maple', 'syrup', 'salt', 'oil']"
225,,"1. Place ingredients in the pan of the bread machine in the order recommended by the manufacturer. Select cycle; press Start. Five minutes into the cycle, check the consistency of the dough. Add additional rice flour or liquid if necessary. 2. When bread is finished, let cool for 10 to 15 minutes before removing from pan.","1 egg, ⅓ cup egg whites, 1 tablespoon apple cider vinegar, ¼ cup canola oil, ¼ cup honey, 1 ½ cups warm skim milk, 1 teaspoon salt, 1 tablespoon xanthan gum, ½ cup tapioca flour, ¼ cup garbanzo bean flour, ¼ cup millet flour, 1 cup white rice flour, 1 cup brown rice flour, 1 tablespoon active dry yeast",Alison's Gluten-Free Bread,,4.5,,https://www.allrecipes.com/recipe/23287/alisons-gluten-free-bread/,"['egg', 'egg', 'apple', 'vinegar', 'oil', 'honey', 'milk', 'salt', 'tapioca', 'flour', 'bean', 'flour', 'flour', 'rice', 'flour', 'rice', 'flour', 'yeast']",non-veg,"['egg', 'egg', 'apple', 'vinegar', 'oil', 'honey', 'milk', 'salt', 'flour', 'bean', 'flour', 'flour', 'rice', 'flour', 'rice', 'flour', 'yeast']"
28,,"1. Blend yeast flakes, parsley, onion, garlic, celery seed, and dill together in a blender until mixture is a fine powder.","2 ½ cups nutritional yeast flakes, 3 tablespoons dried parsley flakes, 2 tablespoons dried onion flakes, 2 tablespoons dried garlic flakes, 2 teaspoons celery seed, 2 teaspoons dried dill weed",Vegan and Gluten-Free Broth Powder,10 mins,5.0,10 mins,https://www.allrecipes.com/recipe/240511/vegan-and-gluten-free-broth-powder/,"['yeast', 'parsley', 'onion', 'garlic', 'celery', 'dill']",veg,"['yeast', 'parsley', 'onion', 'garlic', 'celery', 'dill']"
154,,"1. Preheat oven to 350 degrees F (175 degrees C). Grease and rice flour two 8 or 9 inch round cake pans. 2. Mix the white rice flour, tapioca flour, salt, baking soda, baking powder and xanthan gum together and set aside. 3. Mix the eggs, sugar, and mayonnaise until fluffy. Add the flour mixture, milk and vanilla and mix well. Spread batter into the prepared pans. 4. Bake at 350 degrees F (175 degrees C) for 25 minutes. Cakes are done when they spring back when lightly touched or when a toothpick inserted near the center comes out clean. Let cool completely then frost, if desired.","1 ½ cups white rice flour, ¾ cup tapioca flour, 1 teaspoon salt, 1 teaspoon baking soda, 3 teaspoons baking powder, 1 teaspoon xanthan gum, 4 eggs, 1 ¼ cups white sugar, ⅔ cup mayonnaise, 1 cup milk, 2 teaspoons gluten-free vanilla extract",Gluten-Free Yellow Cake,,4.5,,https://www.allrecipes.com/recipe/8139/gluten-free-yellow-cake/,"['rice', 'flour', 'tapioca', 'flour', 'salt', 'soda', 'egg', 'sugar', 'mayonnaise', 'milk', 'vanilla']",non-veg,"['rice', 'flour', 'flour', 'salt', 'soda', 'egg', 'sugar', 'mayonnaise', 'milk', 'vanilla']"
121,20 mins,"1. In a saucepan, combine apples, water, sugar, and cinnamon. Cover, and cook over medium heat for 15 to 20 minutes, or until apples are soft. Allow to cool, then mash with a fork or potato masher.","4 apples - peeled, cored and chopped, ¾ cup water, ¼ cup white sugar, ½ teaspoon ground cinnamon",Sarah's Homemade Applesauce,10 mins,5.0,30 mins,https://www.allrecipes.com/recipe/51301/sarahs-applesauce/,"['apple', 'water', 'sugar', 'cinnamon']",veg,"['apple', 'water', 'sugar', 'cinnamon']"
45,,"1. Peel and mash avocados in a medium serving bowl. Stir in onion, garlic, tomato, lime juice, salt and pepper. Season with remaining lime juice and salt and pepper to taste. Chill for half an hour to blend flavors.","2 avocados, 1 small onion, finely chopped, 1 clove garlic, minced, 1 ripe tomato, chopped, 1 lime, juiced, salt and pepper to taste",Easy Guacamole,10 mins,4.5,40 mins,https://www.allrecipes.com/recipe/14064/easy-guacamole/,"['avocado', 'onion', 'clove', 'garlic', 'tomato', 'lime', 'salt', 'pepper']",veg,"['avocado', 'onion', 'clove', 'garlic', 'tomato', 'lime', 'salt', 'pepper']"
98,10 mins,"1. Preheat the oven to 350 degrees F (175 degrees C). 2. Mix peanut butter, sugar, and egg together in a bowl using an electric mixer until smooth and creamy. Roll mixture into small balls and arrange on a baking sheet; flatten each with a fork, making a criss-cross pattern. 3. Bake in the preheated oven for 10 minutes. Cool cookies on the baking sheet for 2 minutes before moving to a plate.","1 cup peanut butter, 1 cup white sugar, 1 egg",3-Ingredient Peanut Butter Cookies,10 mins,4.5,22 mins,https://www.allrecipes.com/recipe/244614/3-ingredient-peanut-butter-cookies/,"['peanut', 'butter', 'sugar', 'egg']",non-veg,"['peanut', 'butter', 'sugar', 'egg']"
391,,"1. Place olive oil, lime juice, garlic, salt, and cayenne pepper in a small jar. Close the lid tightly and shake the jar until the dressing is well combined. 2. Combine in a salad bowl beans, corn, avocado, capsicum, tomatoes, green onions, and cilantro. 3. Shake dressing again, pour over salad, and toss to coat.","½ cup olive oil, ⅓ cup fresh lime juice, 1 clove garlic, minced, 1 teaspoon salt, ⅛ teaspoon ground cayenne pepper, 2 (15 ounce) cans black beans, rinsed and drained, 1 ½ cups frozen corn kernels, 1 avocado - peeled, pitted and diced, 1 red capsicum, chopped, 2 tomatoes, chopped, 6 green onions, thinly sliced, ½ cup chopped fresh cilantro",Black Bean and Corn Salad,25 mins,4.5,25 mins,https://www.allrecipes.com/recipe/13933/black-bean-and-corn-salad-ii/,"['oil', 'lime', 'clove', 'garlic', 'salt', 'cayenne', 'pepper', 'bean', 'corn', 'avocado', 'capsicum', 'tomato', 'onion', 'cilantro']",veg,"['oil', 'lime', 'clove', 'garlic', 'salt', 'cayenne', 'pepper', 'bean', 'corn', 'avocado', 'pepper', 'tomato', 'onion', 'cilantro']"
441,1 hr 5 mins,"1. Preheat a gas grill for high heat, or arrange charcoal briquettes on one side of the barbeque. Lightly oil the grate. 2. In a small jar, combine cumin, chili powder, paprika, salt, and pepper. Close the lid, and shake to mix. 3. Trim the membrane sheath from the back of each rack. Run a small, sharp knife between the membrane and each rib, and snip off the membrane as much as possible. Sprinkle as much of the rub onto both sides of the ribs as desired. To prevent the ribs from becoming too dark and spicy, do not thoroughly rub the spices into the ribs. Store the unused portion of the spice mix for future use. 4. Place aluminum foil on lower rack to capture drippings and prevent flare-ups. Lay the ribs on the top rack of the grill (away from the coals, if you're using briquettes). Reduce gas heat to low, close lid, and leave undisturbed for 1 hour. Do not lift the lid at all. 5. Brush ribs with barbecue sauce, and grill an additional 5 minutes. Serve ribs as whole rack, or cut between each rib bone and pile individually on a platter.","1 tablespoon ground cumin, 1 tablespoon chili powder, 1 tablespoon paprika, salt and pepper to taste, 3 pounds baby back pork ribs, 1 cup barbeque sauce",Prize Winning Baby Back Ribs,30 mins,4.5,1 hr 35 mins,https://www.allrecipes.com/recipe/14539/prize-winning-baby-back-ribs/,"['cumin', 'chili', 'paprika', 'salt', 'pepper', 'pork', 'rib', 'sauce']",non-veg,"['cumin', 'chili', 'paprika', 'salt', 'pepper', 'pork', 'rib', 'sauce']"
135,10 mins,"1. Preheat the oven to 350 degrees F (175 degrees C). Spray a baking sheet with cooking spray. 2. Heat a cast-iron skillet over high heat until it is smoking hot, about 5 minutes. 3. While the skillet is heating, mix together paprika, cayenne, cumin, thyme, onion powder, white pepper, and salt in a small bowl. Spray chicken breasts on both sides with cooking spray, then coat evenly with spice mixture. 4. Place chicken in the hot pan and cook for 1 minute. Turn, and cook 1 minute on other side. Transfer chicken to the prepared baking sheet. 5. Bake in the preheated oven until chicken is no longer pink in the center and the juices run clear, about 5 minutes.","½ teaspoon paprika, ¼ teaspoon cayenne pepper, ¼ teaspoon ground cumin, ¼ teaspoon dried thyme, ⅛ teaspoon onion powder, ⅛ teaspoon ground white pepper, ⅛ teaspoon salt, 2 skinless, boneless chicken breast halves, cooking spray",Blackened Chicken,10 mins,4.5,20 mins,https://www.allrecipes.com/recipe/8571/blackened-chicken/,"['paprika', 'cayenne', 'pepper', 'cumin', 'thyme', 'onion', 'pepper', 'salt', 'chicken']",non-veg,"['paprika', 'cayenne', 'pepper', 'cumin', 'thyme', 'onion', 'pepper', 'salt', 'chicken']"
53,3 mins,"1. Preheat grill for high heat. 2. Lightly coat the asparagus spears with olive oil. Season with salt and pepper to taste. 3. Grill over high heat for 2 to 3 minutes, or to desired tenderness.","1 pound fresh asparagus spears, trimmed, 1 tablespoon olive oil, salt and pepper to taste",Grilled Asparagus,15 mins,4.5,18 mins,https://www.allrecipes.com/recipe/17445/grilled-asparagus/,"['asparagus', 'oil', 'salt', 'pepper']",veg,"['asparagus', 'oil', 'salt', 'pepper']"
132,10 mins,"1. Bring a shallow pot of lightly salted water to a boil over medium-high heat. Add frozen peas, and cook for 3 minutes, or until tender. 2. Drain peas, and transfer to a blender or large food processor. Add cream, butter, salt, and pepper, and process until blended, but still thick with small pieces of peas. 3. Adjust seasonings to taste, and serve immediately.","1 (10 ounce) package frozen green peas, ¼ cup heavy cream, 1 tablespoon butter, ½ teaspoon salt, ½ teaspoon freshly ground black pepper",Mushy Peas,5 mins,4.5,15 mins,https://www.allrecipes.com/recipe/50281/mushy-peas-i/,"['pea', 'cream', 'butter', 'salt', 'pepper']",veg,"['pea', 'cream', 'butter', 'salt', 'pepper']"
