calories,cook,directions,ingredients,name,prep,rating,ready in,url,keyword,veg/nonveg,core
94,,"1. Mash jellied cranberry sauce in a 3-quart bowl. Stir gelatin mix thoroughly into cranberry sauce. Pour boiling water into mixture and stir until gelatin has dissolved completely, about 3 minutes. 2. Chill in refrigerator until softly set, 2 to 3 hours. Gently fold sour cream into gelatin mixture, leaving marbled streaks of sour cream and gelatin mix. Return to refrigerator until firmly set, 4 hours to overnight. Store leftovers in refrigerator.","1 (16 ounce) can jellied cranberry sauce, 2 (3 ounce) packages black cherry-flavored gelatin mix (such as Jell-O®), 1 ¾ cups boiling water, 1 (16 ounce) carton sour cream",Sour Cream Cranberry Jell-O® Salad,10 mins,4.5,6 hrs 10 mins,https://www.allrecipes.com/recipe/229676/sour-cream-cranberry-jell-o-salad/,"['cranberry', 'sauce', 'water', 'cream']",veg,"['cranberry', 'sauce', 'water', 'cream']"
123,,"1. Whisk 1 tablespoon pineapple juice, Greek yogurt, honey, and lime zest in a medium bowl. Fold in pineapple chunks and blueberries until coated with yogurt mixture. Serve immediately.","1 (20 ounce) can pineapple chunks in juice, drained, juice reserved, 3 tablespoons whole-milk plain Greek yogurt, 1 teaspoon honey, or to taste, ¼ teaspoon grated lime zest, 1 cup fresh blueberries",Blueberry-Pineapple Salad with Creamy Yogurt Dressing,10 mins,4.5,10 mins,https://www.allrecipes.com/recipe/266549/blueberry-pineapple-salad-with-creamy-yogurt-dressing/,"['pineapple', 'whole-milk', 'yogurt', 'honey', 'lime', 'blueberry']",veg,"['pineapple', 'whole-milk', 'yogurt', 'honey', 'lime', 'blueberry']"
76,,"1. Whisk lime juice, honey, lime zest, balsamic vinegar, and brown sugar together in a small bowl. 2. Place mangos and papaya in a large bowl. Stir lime dressing again and pour over fruit. Lightly stir fruit and dressing, cover, and refrigerate for 1 hour.","¼ cup freshly squeezed lime juice, ¼ cup honey, 1 tablespoon finely grated lime zest, 1 tablespoon balsamic vinegar, 1 tablespoon brown sugar, 2 mangos, peeled and diced, or to taste, 1 large papaya, peeled and diced",Mango Papaya Fruit Salad,20 mins,4.0,1 hr 20 mins,https://www.allrecipes.com/recipe/270424/mango-papaya-fruit-salad/,"['lime', 'honey', 'lime', 'vinegar', 'sugar', 'mango', 'papaya']",veg,"['lime', 'honey', 'lime', 'vinegar', 'sugar', 'mango', 'papaya']"
393,,"1. Mix cream cheese, sour cream, sugar, and vanilla extract together in a bowl; fold in grapes, coconut, and pecans. Refrigerate for flavors to blend, at least 30 minutes.","1 (8 ounce) package fat-free cream cheese, softened, 1 (8 ounce) container fat-free sour cream, ⅓ cup white sugar, 1 teaspoon vanilla extract, 4 pounds red seedless grapes, ⅓ cup shredded coconut, ⅓ cup chopped pecans (Optional)",Grape and Coconut Salad,10 mins,5.0,40 mins,https://www.allrecipes.com/recipe/233275/grape-and-coconut-salad/,"['cream', 'cheese', 'cream', 'sugar', 'vanilla', 'grape', 'coconut', 'pecan']",veg,"['cream', 'cheese', 'cream', 'sugar', 'vanilla', 'grape', 'coconut', 'pecan']"
306,,"1. If using frozen cranberries let thaw before using. In a food processor or blender grind the cranberries. Add the sugar, crushed pineapple and marshmallows. Let mixture stand overnight. 2. Just before serving stir in the sliced banana and whipped cream.","1 pound fresh or frozen cranberries, 8 ounces miniature marshmallows, 2 cups white sugar, 1 (20 ounce) can crushed pineapple with juice, 1 banana, peeled and sliced, 1 cup whipped cream",Fluffy Cranberry Salad,10 mins,4.5,12 hrs 10 mins,https://www.allrecipes.com/recipe/9108/fluffy-cranberry-salad/,"['cranberry', 'marshmallow', 'sugar', 'pineapple', 'banana', 'cream']",veg,"['cranberry', 'marshmallow', 'sugar', 'pineapple', 'banana', 'cream']"
217,30 mins,"1. Bring a large pot of water to a boil. Cut the ends off of the bananas, and make a slit lengthwise down the peel. Cook bananas in boiling water until tender (similar to a potato). Drain, cool, and remove peels. Cut into small chunks and place in a serving bowl. Drizzle 1 tablespoon of olive oil over the pieces, and stir to coat. 2. Meanwhile, heat the remaining tablespoon of oil in a skillet over medium-high heat. Add shrimp and crab, and fry until cooked through, about 5 minutes. Set aside to cool. 3. Add onions, green pepper and seafood to the bananas in the bowl. In a separate bowl, whisk together the red wine vinegar, sugar and bacon pieces. Pour this mixture over the bananas, and toss lightly to coat. Season with salt and pepper. Garnish with slices of hard-cooked egg if desired.","6 small unripe (green) bananas, 2 tablespoons olive oil, divided, 1 green capsicum, sliced into thin rings, 1 cup small shrimp - peeled and deveined, 1 cup crabmeat, 1 sweet onion, chopped, 1 pinch salt and pepper to taste, 1 teaspoon white sugar, ¾ cup red wine vinegar, 2 slices crisp cooked bacon, crumbled, 1 hard-cooked egg, peeled and sliced (Optional)",Joy's Green Banana Salad,20 mins,4.0,50 mins,https://www.allrecipes.com/recipe/60908/joys-green-banana-salad/,"['banana', 'oil', 'capsicum', 'shrimp', 'onion', 'salt', 'pepper', 'sugar', 'vinegar', 'bacon', 'egg']",non-veg,"['banana', 'oil', 'pepper', 'shrimp', 'onion', 'salt', 'pepper', 'sugar', 'vinegar', 'bacon', 'egg']"
250,,"1. Combine pineapple chunks, grapes, mandarin oranges, coconut, marshmallows, yogurt, pecans, and sugar in a large bowl; mix to combine. Serve immediately or for best results, chill for 2 to 3 hours.","1 (20 ounce) can pineapple chunks, drained, 1 ½ cups seedless green grapes, 1 (11 ounce) can mandarin oranges, drained, 1 cup flaked coconut, 1 cup miniature marshmallows, ¾ cup vanilla yogurt, ½ cup chopped pecans, 1 tablespoon white sugar",Ambrosia Salad with Yogurt,10 mins,,10 mins,https://www.allrecipes.com/recipe/277215/ambrosia-salad-with-yogurt/,"['pineapple', 'grape', 'mandarin', 'orange', 'coconut', 'marshmallow', 'vanilla', 'yogurt', 'pecan', 'sugar']",veg,"['pineapple', 'grape', 'mandarin', 'orange', 'coconut', 'marshmallow', 'vanilla', 'yogurt', 'pecan', 'sugar']"
131,,"1. Dissolve cherry gelatin mix in boiling water in a bowl; stir cranberry sauce and oranges into gelatin. Refrigerate until mixture is thickened to the consistency of egg whites, about 45 minutes. Mix apple and walnuts into gelatin, transfer to a serving dish or mold, and chill until firm, about 2 more hours.","1 (6 ounce) package cherry-flavored gelatin mix (such as Jell-O®), 1 ½ cups boiling water, 2 (14.5 ounce) cans whole berry cranberry sauce, 2 oranges, peeled and chopped, 1 cup diced apple, 1 cup chopped walnuts",Cranberry Jell-O® Salad with Walnuts,15 mins,4.5,3 hrs,https://www.allrecipes.com/recipe/229674/cranberry-jell-o-salad-with-walnuts/,"['water', 'berry', 'cranberry', 'sauce', 'orange', 'apple', 'walnut']",veg,"['water', 'berry', 'cranberry', 'sauce', 'orange', 'apple', 'walnut']"
148,,"1. Place half of the mango and half of the papaya into the container of a food processor or blender along with balsamic vinegar. Puree until smooth, and set aside. 2. Melt butter in a small skillet over medium heat. Add almonds, and cook stirring constantly until lightly browned. Add brown sugar, and stir to coat. Remove from heat, and pour candied almonds onto a piece of waxed paper, separating any clumps. Set aside to cool. 3. Just before serving, place romaine lettuce in a large serving bowl. Cube remaining mango and papaya halves, and toss gently with avocado and lettuce. Drizzle the pureed fruit over the salad and lightly salt. Sprinkle with candied almonds, and serve immediately.","1 large mango - peeled, seeded and halved, 1 medium papaya - peeled, seeded and halved, 1 avocado - peeled, pitted and diced, 3 tablespoons balsamic vinegar, 1 tablespoon butter, ¼ cup blanched slivered almonds, 1 teaspoon brown sugar, 1 head romaine lettuce, torn into bite-size pieces, salt to taste",Georgie's Mango Papaya Salad,15 mins,4.5,15 mins,https://www.allrecipes.com/recipe/57832/georgies-mango-papaya-salad/,"['mango', 'papaya', 'avocado', 'vinegar', 'butter', 'almond', 'sugar', 'salt']",veg,"['mango', 'papaya', 'avocado', 'vinegar', 'butter', 'almond', 'sugar', 'salt']"
225,,"1. Combine the pineapple, Mandarin oranges, marshmallows, and sour cream in a bowl. Gently fold the cornflakes cereal into the mixture. Sprinkle the coconut over the top; stir into the salad just before serving.","1 cup pineapple chunks, drained, 1 cup Mandarin orange segments, drained, 1 cup miniature marshmallows, 1 cup sour cream, 1 cup cornflakes cereal, 1 cup flaked coconut",One Cup Salad,5 mins,4.0,5 mins,https://www.allrecipes.com/recipe/203133/one-cup-salad/,"['pineapple', 'mandarin', 'orange', 'marshmallow', 'cream', 'cereal', 'coconut']",veg,"['pineapple', 'mandarin', 'orange', 'marshmallow', 'cream', 'cereal', 'coconut']"
535,15 mins,"1. Preheat the oven to 350 degrees F (175 degrees C). Place the rice cereal and nuts into a baking pan. Stir in the brown sugar and margarine. Bake for 10 to 15 minutes, until toasty. Stir occasionally. Set aside to cool. 2. In the container of a blender or large food processor, combine the strawberries, orange juice, confectioners' sugar and vanilla sugar. Puree into a smooth sauce. Set aside. 3. To make the salad, toss the red, green and yellow apples with oranges and pineapple in a large serving bowl. Sprinkle with the nut crunch and spoon strawberry sauce over the top. Or you can serve the toppings on the side.","2 ½ cups crispy rice cereal, 1 ½ cups chopped hazelnuts, ¾ cup packed brown sugar, ½ cup margarine, melted, 1 pound fresh or frozen sliced strawberries, ⅓ cup orange juice, 2 tablespoons confectioners' sugar, 1 tablespoon vanilla sugar, 2 Red Delicious apples, cored and diced, 2 Golden Delicious apples, cored and diced, 2 Granny Smith apples, cored and diced, 4 seedless oranges, peeled and diced, 1 (20 ounce) can crushed pineapple, drained",Strawberry-Sauced Crunchy Fruit Salad,20 mins,4.5,35 mins,https://www.allrecipes.com/recipe/80744/strawberry-sauced-crunchy-fruit-salad/,"['rice', 'cereal', 'hazelnut', 'sugar', 'margarine', 'strawberry', 'orange', 'sugar', 'vanilla', 'sugar', 'apple', 'apple', 'apple', 'orange', 'pineapple']",veg,"['rice', 'cereal', 'hazelnut', 'sugar', 'margarine', 'strawberry', 'orange', 'sugar', 'vanilla', 'sugar', 'apple', 'apple', 'apple', 'orange', 'pineapple']"
136,,"1. Combine cream cheese and sugar in a bowl; add strawberries and pineapple. Fold in the whipped topping. 2. Line a loaf pan with parchment paper. Pour the strawberry mixture into the loaf pan. 3. Place in the freezer until firm, about 6 hours. Set loaf pan in a warm water bath to loosen. Flip mixture onto a cutting board to remove; cut into slices.","1 (8 ounce) package cream cheese, softened, ½ cup white sugar, 1 (10 ounce) package frozen strawberries in juice, thawed, ½ cup crushed pineapple, drained, 1 (8 ounce) container frozen whipped topping, thawed",Frozen Strawberry Salad,15 mins,3.0,6 hrs 15 mins,https://www.allrecipes.com/recipe/254502/frozen-strawberry-salad/,"['cream', 'cheese', 'sugar', 'strawberry', 'pineapple']",veg,"['cream', 'cheese', 'sugar', 'strawberry', 'pineapple']"
275,,"1. Stir marshmallows, cranberries, and sugar together in a saucepan over low heat; cook and stir until the marshmallows melt completely, about 15 minutes. Transfer marshmallow mixture to a bowl and refrigerate 4 hours to overnight. 2. Stir apples, grapes, walnuts, and salt into the marshmallow mixture. 3. Beat whipping cream in a chilled bowl using an electric mixer until stiff peaks form; fold into the marshmallow mixture.","3 cups miniature marshmallows, 2 cups ground cranberries, ¾ cup white sugar, 2 cups diced apple, ½ cup seedless grapes, halved, ½ cup chopped walnuts (Optional), ¼ teaspoon salt, ½ cup heavy whipping cream",Cranberry Fluff,20 mins,5.0,4 hrs 20 mins,https://www.allrecipes.com/recipe/233242/cranberry-fluff/,"['marshmallow', 'cranberry', 'sugar', 'apple', 'grape', 'walnut', 'salt', 'cream']",veg,"['marshmallow', 'cranberry', 'sugar', 'apple', 'grape', 'walnut', 'salt', 'cream']"
323,10 mins,"1. Bring 1 1/2 cups of seasoned rice vinegar to a boil in a saucepan, and mix in the 2 pieces of crushed ginger root, shallots, red pepper flakes, 1/4 cup of light brown sugar, and 1 teaspoon of salt. Stir until the brown sugar and salt have dissolved, and remove from heat. Place watermelon rind into a large heatproof nonreactive bowl, and strain the pickling liquid through a fine mesh strainer into the watermelon rind. Stir to combine, and refrigerate at least 1 hour. 2. Place the bacon in a large, deep skillet, and cook over medium-high heat, turning occasionally, until evenly browned, about 10 minutes. Drain the bacon slices on a paper towel-lined plate. Chop the bacon into pieces when cooled. 3. For dressing, place 1/2 cup of peeled and chopped ginger, garlic, lime juice, 1 cup of seasoned rice vinegar, 2 tablespoons of light brown sugar, 1/2 teaspoon of salt, and cilantro stems in a blender. Blend on high speed, scraping down blender sides occasionally, until the ginger and cilantro stems are pulverized and the dressing is thoroughly blended. 4. To assemble, place about 1 cup of watermelon cubes onto a salad plate, and drizzle with about 2 tablespoons of the dressing. Top with about 2 tablespoons of the pickled rind, 1 to 2 tablespoons of bacon bits, 1 tablespoon of cilantro leaves, and about 1/2 tablespoon of chopped green onion, or to taste.","1 ½ cups seasoned rice vinegar, 2 (3 inch) pieces fresh ginger root, peeled and lightly crushed, 2 shallots, chopped, 2 teaspoons crushed red pepper flakes, or to taste, ¼ cup light brown sugar, 1 teaspoon salt, 4 cups watermelon rind, white part only, cut into 1/2-inch cubes, 1 (1 pound) package thick cut bacon, ½ cup peeled and chopped fresh ginger root, 2 cloves garlic, peeled, 4 limes, juiced, 1 cup seasoned rice vinegar, 2 tablespoons light brown sugar, ½ teaspoon salt, 1 bunch cilantro, stems and leaves separated, 12 cups chilled seedless watermelon, peeled and cut into 1-inch cubes, 1 bunch green onions, chopped",Malaysian Watermelon Salad,1 hr,5.0,2 hrs 10 mins,https://www.allrecipes.com/recipe/218131/malaysian-watermelon-salad/,"['rice', 'vinegar', 'ginger', 'shallot', 'pepper', 'sugar', 'salt', 'watermelon', 'bacon', 'ginger', 'clove', 'garlic', 'lime', 'rice', 'vinegar', 'sugar', 'salt', 'cilantro', 'watermelon', 'onion']",veg,"['rice', 'vinegar', 'ginger', 'shallot', 'pepper', 'sugar', 'salt', 'watermelon', 'bacon', 'ginger', 'clove', 'garlic', 'lime', 'rice', 'vinegar', 'sugar', 'salt', 'cilantro', 'watermelon', 'onion']"
257,,"1. Attach apple to a spiralizer and cut into ribbons. 2. Whisk Greek yogurt, honey, cinnamon, and vanilla extract together in a bowl until blended. Add apple; toss to coat. Garnish with walnuts.","1 Red Delicious apple, 1 (6 ounce) container plain Greek yogurt, 2 teaspoons honey, or more to taste, ¼ teaspoon ground cinnamon, ¼ teaspoon vanilla extract, ¼ cup chopped walnuts",Spiralized Apple 'Spaghetti' with Cinnamon Dressing,10 mins,4.5,10 mins,https://www.allrecipes.com/recipe/255198/spiralized-apple-spaghetti-with-cinnamon-dressing/,"['apple', 'yogurt', 'honey', 'cinnamon', 'vanilla', 'walnut']",veg,"['apple', 'yogurt', 'honey', 'cinnamon', 'vanilla', 'walnut']"
279,,"1. Combine strawberries, mozzarella cheese, and basil in a bowl. 2. Whisk together olive oil, lemon juice, sugar, salt, and pepper in a cup and pour over salad.","1 pound fresh strawberries, hulled and halved, 8 ounces fresh mozzarella balls (bocconcini), halved, ½ cup fresh basil leaves, slivered, 3 tablespoons extra-virgin olive oil, 2 tablespoons lemon juice, 1 teaspoon white sugar, ½ teaspoon salt, ½ teaspoon freshly cracked black pepper",Strawberry Caprese Salad,10 mins,4.5,10 mins,https://www.allrecipes.com/recipe/265495/strawberry-caprese-salad/,"['strawberry', 'mozzarella', 'basil', 'oil', 'lemon', 'sugar', 'salt', 'pepper']",veg,"['strawberry', 'mozzarella', 'basil', 'oil', 'lemon', 'sugar', 'salt', 'pepper']"
117,,"1. Place lime slices, tangerine sections, navel orange, and grapefruit in a bowl. In a separate bowl, mix the lime zest, mandarin orange zest, shallots, lemon juice, olive oil, and salt. Pour over the fruit. Arrange dressed fruit atop romaine lettuce to serve.","1 lime - zested, peeled, and sliced, 1 mandarin orange (tangerine) - zested, peeled, and sectioned, 1 navel orange, peeled and sectioned, 1 grapefruit, peeled and sectioned, 1 bulb shallots, diced, 1 tablespoon lemon juice, 1 tablespoon olive oil, ½ teaspoon salt, 1 head romaine lettuce, torn",Citrus Salad,25 mins,3.0,25 mins,https://www.allrecipes.com/recipe/86805/citrus-salad/,"['lime', 'mandarin', 'orange', 'orange', 'grapefruit', 'shallot', 'lemon', 'oil', 'salt']",veg,"['lime', 'mandarin', 'orange', 'orange', 'grapefruit', 'shallot', 'lemon', 'oil', 'salt']"
194,,"1. Combine the honeydew, cantaloupe, watermelon, grapes, pineapple, pickled ginger, orange juice, lime juice, sugar, and chopped mint in a large bowl; stir to mix evenly. Cover the bowl with plastic wrap and refrigerate at least 1 hour. 2. Gently fold the strawberries into the fruit mixture. Garnish with the mint sprigs to serve.","1 honeydew melon, fruit removed with a melon baller, 1 cantaloupe, fruit removed with a melon baller, ¼ watermelon, fruit removed with a melon baller, 1 bunch grapes, 1 pineapple - peeled, cored, and cut into chunks, 2 tablespoons pickled ginger, 1 cup fresh orange juice, ¼ cup fresh lime juice, 1 tablespoon white sugar, ¼ cup chopped fresh mint, 1 pint fresh strawberries, hulled (Optional), 4 sprigs fresh mint for garnish",Persian Melon Salad,30 mins,5.0,1 hr 30 mins,https://www.allrecipes.com/recipe/215578/persian-melon-salad/,"['honeydew', 'cantaloupe', 'watermelon', 'grape', 'pineapple', 'ginger', 'orange', 'lime', 'sugar', 'mint', 'strawberry', 'mint']",veg,"['honeydew', 'cantaloupe', 'watermelon', 'grape', 'pineapple', 'ginger', 'orange', 'lime', 'sugar', 'mint', 'strawberry', 'mint']"
60,,"1. Gently toss the watermelon, peach, nectarine, plum, blueberries, and grapes together in a large bowl. Sprinkle the coconut and cinnamon over the fruit mixture and lightly stir to mix. Cover the bowl with plastic wrap and chill in refrigerator at least 1 hour before serving. Top with whipped topping as desired.","3 cups cubed (1-inch) seedless watermelon, 1 large white peach, pitted and cut into small cubes, 1 large nectarine, pitted and cut into small cubes, 1 black plum, pitted and cut into small cubes, 1 cup fresh blueberries, ½ cup seedless red grapes, halved, ½ cup shredded coconut, 1 teaspoon ground cinnamon, ½ cup nondairy whipped topping (Optional)",Summer Fruit Salad II,25 mins,4.5,1 hr 25 mins,https://www.allrecipes.com/recipe/215586/summer-fruit-salad-ii/,"['watermelon', 'peach', 'nectarine', 'plum', 'blueberry', 'grape', 'coconut', 'cinnamon']",veg,"['watermelon', 'peach', 'nectarine', 'plum', 'blueberry', 'grape', 'coconut', 'cinnamon']"
373,,1. Mix watermelon and strawberries together in a bowl; add mint leaves and lavender flowers. Squeeze lemon over watermelon mixture and stir.,"¼ watermelon, cut into bite-size pieces, 4 fresh strawberries, hulled and quartered, or more to taste, 1 sprig fresh mint, leaves removed and stem discarded, ½ sprig fresh lavender, flowers removed and stem discarded, ½ lemon","Watermelon, Strawberry, and Herbs",15 mins,,15 mins,https://www.allrecipes.com/recipe/238483/watermelon-strawberry-and-herbs/,"['watermelon', 'strawberry', 'mint', 'lavender', 'lemon']",veg,"['watermelon', 'strawberry', 'mint', 'lavender', 'lemon']"
402,,"1. In a small bowl whisk the mayonnaise, sour cream and honey together. 2. In a large bowl toss 1 cup of the cheese with the lettuce. 3. In a 2 1/2 quart glass bowl, layer half of the lettuce mixture, peaches, remaining lettuce mixture, strawberries, grapes and remaining cheese. Spread mayonnaise mixture over the top or serve on the side. Chill well before serving.","½ cup mayonnaise, ½ cup sour cream, 1 tablespoon honey, 1 ½ cups shredded Cheddar cheese, divided, 4 cups shredded lettuce, 3 cups fresh peaches - peeled, pitted, and sliced, 3 cups sliced fresh strawberries, 3 cups seedless grapes",Layered Cheddar-Fruit Salad,15 mins,4.0,45 mins,https://www.allrecipes.com/recipe/14233/layered-cheddar-fruit-salad/,"['mayonnaise', 'cream', 'honey', 'cheddar', 'cheese', 'peach', 'strawberry', 'grape']",veg,"['mayonnaise', 'cream', 'honey', 'cheddar', 'cheese', 'peach', 'strawberry', 'grape']"
269,,1. Place grapes in a large bowl. Stir in the walnuts. Pour the blue cheese dressing over the grape mixture and stir until everything is evenly coated. Chill until ready to serve.,"1 pound seedless green grapes, rinsed and patted dry, 6 ounces roughly chopped walnuts, ½ cup blue cheese dressing",Grape-Walnut Salad,10 mins,3.5,10 mins,https://www.allrecipes.com/recipe/143005/grape-walnut-salad/,"['grape', 'walnut', 'cheese']",veg,"['grape', 'walnut', 'cheese']"
342,,"1. Mix together the avocado, peach, and onion in a bowl. Pour the lime juice over the mixture and season with salt and pepper. Toss the mixture until evenly coated.","2 avocados - peeled, pitted and diced, 1 fresh peach - peeled, pitted and diced, ½ cup diced sweet onion, 2 tablespoons fresh lime juice, salt and ground black pepper to taste",Avocado and Fruit Salad,25 mins,4.0,25 mins,https://www.allrecipes.com/recipe/143672/avocado-and-fruit-salad/,"['avocado', 'peach', 'onion', 'lime', 'salt', 'pepper']",veg,"['avocado', 'peach', 'onion', 'lime', 'salt', 'pepper']"
62,,"1. Combine mangos, strawberries, and blackberries in a bowl. Toss with cilantro and lime. Refrigerate for 1 hour.","5 mango, peeled and diced, 6 fresh strawberries, sliced, ½ cup blackberries, ¼ cup chopped cilantro, ½ lime, juiced",Mango Madness Salad,20 mins,4.0,20 mins,https://www.allrecipes.com/recipe/72357/mango-madness-salad/,"['mango', 'strawberry', 'blackberry', 'cilantro', 'lime']",veg,"['mango', 'strawberry', 'blackberry', 'cilantro', 'lime']"
183,,"1. Coat pears and apples in lemon juice. 2. Mix dried cranberries, walnuts, granola, brown sugar, cinnamon, and nutmeg together in a large bowl. Toss pears and apples into the mixture.","4 medium ripe pears - peeled, cored, and cubed, 4 medium apples - peeled, cored, and cubed, 1 tablespoon lemon juice, 1 cup sweetened dried cranberries (such as Craisins®), ½ cup chopped walnuts, ½ cup granola, ½ cup brown sugar, 1 teaspoon ground cinnamon, ½ teaspoon ground nutmeg",Fall Harvest Fruit Salad,15 mins,5.0,15 mins,https://www.allrecipes.com/recipe/281967/fall-harvest-fruit-salad/,"['pear', 'apple', 'lemon', 'cranberry', 'walnut', 'sugar', 'cinnamon', 'nutmeg']",veg,"['pear', 'apple', 'lemon', 'cranberry', 'walnut', 'sugar', 'cinnamon', 'nutmeg']"
186,,"1. Slice a little piece off the top and bottom of each orange so you have a stable cutting surface. Trim away all skin and pith with a small sharp knife without taking too much off the fruit. Slice oranges horizontally and arrange on a serving platter. 2. Combine onion, olive oil, lemon juice, and salt in a bowl and pour over the oranges. Grind fresh pepper over the salad and arrange black olives on top.","4 oranges, 3 blood oranges, 1 small onion, finely diced, 3 tablespoons olive oil, 2 tablespoons lemon juice, salt, 1 pinch freshly ground black pepper, 10 dried black olives",Turkish Orange Salad with Mediterranean Dressing,20 mins,5.0,20 mins,https://www.allrecipes.com/recipe/260392/turkish-orange-salad-with-mediterranean-dressing/,"['orange', 'orange', 'onion', 'oil', 'lemon', 'salt', 'pepper', 'olive']",veg,"['orange', 'orange', 'onion', 'oil', 'lemon', 'salt', 'pepper', 'olive']"
240,,"1. Cut the grapefruit in half, and set aside one half. Juice the remaining half, and combine with honey, cilantro, and orange extract. Set aside. 2. Segment the reserved grapefruit, and combine with jicama, pears, oranges, apples, and mango in a large bowl. Pour cilantro dressing over the fruit, and stir to combine. Chill in the refrigerator for at least one hour before serving.","1 large grapefruit, 2 tablespoons honey, ⅓ bunch fresh cilantro, chopped, ⅛ teaspoon orange extract, 2 jicama, peeled and diced, 2 pears - peeled, cored and diced, 3 oranges - peeled, sectioned, and cut into bite-size pieces, 2 Golden Delicious apples - peeled, cored and diced, 1 mango - peeled, seeded, and cubed",Schmag Salad,10 mins,4.5,10 mins,https://www.allrecipes.com/recipe/20183/schmag-salad/,"['grapefruit', 'honey', 'cilantro', 'orange', 'jicama', 'pear', 'orange', 'apple', 'mango']",veg,"['grapefruit', 'honey', 'cilantro', 'orange', 'jicama', 'pear', 'orange', 'apple', 'mango']"
121,,"1. Combine the watermelon, water chestnuts, sesame seeds, salt, garlic chives, and cilantro in a large mixing bowl. 2. Whisk the raspberry vinegar, white sugar, sesame oil, and fish sauce together in a small bowl; pour over the watermelon salad mixture and gently toss to coat evenly. Chill in refrigerator 1 hour to serve chilled.","1 pound watermelon, seeded and cut into chunks, 1 (8 ounce) can water chestnuts, drained and halved, 1 ¾ ounces sesame seeds, or as desired, 1 teaspoon salt, ½ bunch garlic chives, finely chopped, ½ bunch fresh cilantro leaves, chopped, ¼ cup raspberry vinegar, 2 tablespoons white sugar, 1 teaspoon sesame oil, 1 dash fish sauce",Watermelon and Sesame Seed Salad,15 mins,3.0,1 hr 15 mins,https://www.allrecipes.com/recipe/215584/watermelon-and-sesame-seed-salad/,"['watermelon', 'water', 'chestnut', 'salt', 'garlic', 'chive', 'cilantro', 'raspberry', 'vinegar', 'sugar', 'oil', 'fish', 'sauce']",non-veg,"['watermelon', 'water', 'chestnut', 'salt', 'garlic', 'chive', 'cilantro', 'raspberry', 'vinegar', 'sugar', 'oil', 'fish', 'sauce']"
