calories,cook,directions,ingredients,name,prep,rating,ready in,url,keyword,veg/nonveg,core
279,5 mins,"1. Preheat the oven's broiler and set the oven rack about 6 inches from the heat source. 2. Place the grapefruit sections, orange sections, and pineapple chunks into an 8x8-inch baking dish. Stir the brown sugar and butter together in a small bowl, and scatter the butter mixture evenly across the fruit. 3. Broil the fruit until the sugar is bubbly, 5 to 6 minutes. Allow to cool for several minutes before serving warm.","2 red grapefruit, peeled and sectioned, 2 large oranges, peeled and sectioned, 1 cup fresh pineapple chunks, ½ cup packed brown sugar, 2 tablespoons butter, softened",Warm Winter Citrus Dessert,20 mins,4.0,35 mins,https://www.allrecipes.com/recipe/215981/warm-winter-citrus-dessert/,"['grapefruit', 'orange', 'pineapple', 'sugar', 'butter']",veg,"['grapefruit', 'orange', 'pineapple', 'sugar', 'butter']"
165,20 mins,"1. Wash and dry beet roots and greens. Shred greens to measure 2 cups and set aside. 2. Place beets in a sauce pan with enough water to cover. Bring to boil, cover, reduce heat and simmer for 20 minutes or until tender. Drain and allow to cool. 3. Trim and peel off skins; cut into 8 wedges. 4. Peel and section orange. In a bowl, combine orange sections, beets and apples. 5. Whisk together olive oil, vinegar, sugar, salt and garlic. Pour over beet mixture and toss well. 6. Arrange 1/2 cup beet greens on 4 salad plates. Top with beet mixture, sprinkle with sunflower seeds and serve.","1 ½ pounds beets, 2 cups shredded beet greens, 1 large orange, 2 Granny Smith apples - peeled, cored and sliced, 1 tablespoon olive oil, 1 tablespoon raspberry vinegar, ½ teaspoon white sugar, ¼ teaspoon salt, 1 clove garlic, minced, 2 tablespoons unsalted sunflower seeds, toasted","Beet, Orange and Apple Salad",20 mins,4.5,40 mins,https://www.allrecipes.com/recipe/14471/beet-orange-and-apple-salad/,"['beet', 'beet', 'orange', 'apple', 'oil', 'raspberry', 'vinegar', 'sugar', 'salt', 'clove', 'garlic']",veg,"['beet', 'beet', 'orange', 'apple', 'oil', 'raspberry', 'vinegar', 'sugar', 'salt', 'clove', 'garlic']"
196,,"1. To make pickled onions, combine the thinly sliced red onion and the red wine vinegar in a small bowl. Cover; chill for at least one hour. 2. Pour the orange juice into a large salad bowl. Whisk in the olive oil and orange zest; season with 1/4 teaspoon salt, and a pinch of black pepper. Toss the cantaloupe, watermelon, and mango in the dressing. Just before serving, stir in the pickled onions and cilantro leaves. 3. Cut the avocados into 1/2 inch dice; place in a small bowl. Sprinkle with the lime juice, and season with the remaining 1/4 teaspoon salt. Stir lightly to combine. Spoon an even amount of avocado into the bottom of 6 large martini or wine glasses. Top avocado with melon salad; garnish each salad with a lime slice.","1 small red onion, very thinly sliced, 2 tablespoons red wine vinegar, ½ cup freshly squeezed orange juice, 2 teaspoons extra-virgin olive oil, 1 tablespoon grated orange zest, ¼ teaspoon kosher salt, freshly ground black pepper, 2 cups small cantaloupe balls, 2 cups 1/2-inch diced seedless watermelon, 1 ripe mango, cut into 1/4-inch dice, 1 cup loosely packed cilantro leaves, 2 ripe Hass avocados, 1 tablespoon fresh lime juice, ¼ teaspoon kosher salt, 6 thin lime slices","Melon, Mango, and Avocado Salad",30 mins,4.5,1 hr 30 mins,https://www.allrecipes.com/recipe/203400/melon-mango-and-avocado-salad/,"['onion', 'vinegar', 'orange', 'oil', 'orange', 'salt', 'pepper', 'cantaloupe', 'watermelon', 'mango', 'cilantro', 'avocado', 'lime', 'salt', 'lime']",veg,"['onion', 'vinegar', 'orange', 'oil', 'orange', 'salt', 'pepper', 'cantaloupe', 'watermelon', 'mango', 'cilantro', 'avocado', 'lime', 'salt', 'lime']"
163,,"1. In a large salad bowl, gently toss together the watermelon, cantaloupe, pineapple, strawberries, peaches, grapes, and kiwi until thoroughly combined. 2. Combine the water and orange juice, limeade, and lemonade concentrates in a small bowl. Pour the dressing over the fruit salad. Gently toss, and sprinkle the salad with toasted pecans. Serve salad scooped on lettuce leaves.","2 cups watermelon, seeded and cut into bite-size pieces, 2 cups cantaloupe, cut into bite-size pieces, 2 cups fresh pineapple chunks, 2 cups strawberries, hulled and halved if large, 2 cups fresh peaches - peeled, pitted, and cut into bite-size pieces, 1 cup seedless grapes, 1 cup kiwi fruit, peeled and cut into bite-size pieces, ¼ cup cold water, ¼ cup frozen orange juice concentrate, thawed, ¼ cup frozen limeade concentrate, thawed, ¼ cup frozen lemonade concentrate, thawed, 1 cup toasted pecans, 12 lettuce leaves",Summer Fresh Fruit Salad,45 mins,5.0,45 mins,https://www.allrecipes.com/recipe/218886/summer-fresh-fruit-salad/,"['watermelon', 'cantaloupe', 'pineapple', 'strawberry', 'peach', 'grape', 'kiwi', 'water', 'orange', 'lemonade', 'pecan']",veg,"['watermelon', 'cantaloupe', 'pineapple', 'strawberry', 'peach', 'grape', 'kiwi', 'water', 'orange', 'lemonade', 'pecan']"
236,15 mins,"1. Bring water and sugar to a boil in a medium saucepan over medium heat. Stir in the rhubarb, turn heat to low, cover, and simmer until rhubarb is soft, 10 to 15 minutes. Mash and chill in the refrigerator, about one hour. 2. To serve, mix the grapes, orange, strawberries, apple, peach, plum, cherries, and blueberries with 2/3 cup of the rhubarb sauce. Stir gently, but thoroughly to coat. Refrigerate for at least two hours to allow the flavors to blend.","½ cup water, ⅔ cup sugar, 3 cups thinly sliced rhubarb, 15 seedless grapes, halved, ½ orange, sectioned, 10 fresh strawberries, hulled and halved, 1 apple, cored and diced, 1 peach, sliced, 1 plum, pitted and sliced, 15 pitted Bing cherries, ¼ cup fresh blueberries",Fresh Summer Fruit Salad,30 mins,4.5,3 hrs 45 mins,https://www.allrecipes.com/recipe/90184/fresh-summer-fruit-salad/,"['water', 'sugar', 'rhubarb', 'grape', 'orange', 'strawberry', 'apple', 'peach', 'plum', 'cherry', 'blueberry']",veg,"['water', 'sugar', 'rhubarb', 'grape', 'orange', 'strawberry', 'apple', 'peach', 'plum', 'cherry', 'blueberry']"
771,,"1. Mix together the cranberries and sugar; cover and refrigerate overnight. 2. The next day, combine the cranberry mixture with the pineapple, marshmallows, pecans and whipped cream. Mix well. 3. Pour into a 3 quart dish, cover and refrigerate or freeze until ready to serve.","1 pound cranberries, finely ground, 2 cups white sugar, 1 (20 ounce) can crushed pineapple, drained, 1 (16 ounce) package miniature marshmallows, 1 cup chopped pecans (Optional), 1 pint whipped cream, beaten stiff",Christmas Cranberry Salad,,4.5,,https://www.allrecipes.com/recipe/15691/christmas-cranberry-salad/,"['cranberry', 'sugar', 'pineapple', 'marshmallow', 'pecan', 'cream']",veg,"['cranberry', 'sugar', 'pineapple', 'marshmallow', 'pecan', 'cream']"
183,5 mins,"1. Combine pineapple juice, sugar, lemon juice, and cornstarch in a saucepan over medium heat; cook and stir until sugar dissolves and sauce is smooth, about 5 minutes. 2. Stir about 1 tablespoon sauce into the bowl with the egg until egg is slightly warmed. Slowly pour egg mixture into sauce, whisking until sauce is smooth and thickened. Remove saucepan from heat and freeze sauce, stirring occasionally, until completely chilled, about 15 minutes. 3. Mix bananas, cream cheese, and pineapple together in a bowl. Add sauce and mix until evenly coated.","½ cup pineapple juice, ½ cup white sugar, 2 tablespoons lemon juice, 2 teaspoons cornstarch, 1 egg, well-beaten, 6 large bananas, sliced, 1 (8 ounce) package cream cheese, softened, 1 (8 ounce) can pineapple tidbits, drained",Banana Salad,10 mins,,30 mins,https://www.allrecipes.com/recipe/244451/banana-salad/,"['pineapple', 'sugar', 'lemon', 'cornstarch', 'egg', 'banana', 'cream', 'cheese', 'pineapple']",non-veg,"['pineapple', 'sugar', 'lemon', 'cornstarch', 'egg', 'banana', 'cream', 'cheese', 'pineapple']"
115,,"1. Mix watermelon, pineapple, and strawberries in a serving bowl. 2. Whisk tequila, agave nectar, lime zest, and lime juice together in a bowl; pour dressing over fruit. Toss to coat.","3 cups watermelon chunks, 3 cups pineapple chunks, 2 cups sliced strawberries, ¼ cup silver tequila, or more to taste, ¼ cup agave nectar, or more to taste, 3 limes, zested and juiced",Tipsy Fruit,20 mins,5.0,20 mins,https://www.allrecipes.com/recipe/232364/tipsy-fruit/,"['watermelon', 'pineapple', 'strawberry', 'tequila', 'lime']",veg,"['watermelon', 'pineapple', 'strawberry', 'tequila', 'lime']"
190,,"1. Combine watermelon, strawberries, bananas, and mandarin slices in a large bowl. Pour in vodka and toss to coat. Cover with plastic wrap and let chill in the refrigerator until serving.","4 cups seedless watermelon balls, 3 cups fresh strawberries, 3 cups sliced bananas, 2 ½ cups mandarin orange slices, 1 cup orange-flavored vodka",Boozy Fruit Salad,15 mins,,15 mins,https://www.allrecipes.com/recipe/274209/boozy-fruit-salad/,"['watermelon', 'strawberry', 'banana', 'mandarin', 'orange', 'vodka']",veg,"['watermelon', 'strawberry', 'banana', 'mandarin', 'orange', 'vodka']"
174,,"1. Place watermelon in a non-reactive container with a tight-fitting lid. Add cachaca and sugar. Cover container with the lid and shake until watermelon is coated and sugar is dissolved. 2. Refrigerate watermelon until watermelon is fully infused, 2 hours to overnight. Shake mixture again before serving.","1 small watermelon, cut into 1-inch pieces, 1 cup cachaca (Brazilian sugar cane spirit), 2 tablespoons turbinado sugar, or to taste",Boozy Watermelon,10 mins,5.0,2 hrs 10 mins,https://www.allrecipes.com/recipe/237702/boozy-watermelon/,"['watermelon', 'sugar', 'sugar']",veg,"['watermelon', 'sugar', 'sugar']"
118,,"1. In a blender or food processor, combine banana, orange juice, lime juice, poppy seeds, raspberry vinegar, olive oil, raspberries, salt and cayenne pepper, and puree until smooth. Cover tightly and refrigerate until ready to use. 2. Combine grapes, watermelon, strawberries, cantaloupe, blueberries and plums in a large bowl. Pour dressing over fruit and toss to coat.","1 banana, sliced, ½ cup orange juice, 1 tablespoon lime juice, 2 tablespoons poppy seeds, 1 tablespoon raspberry vinegar, ¼ teaspoon olive oil, ¼ cup raspberries, ⅛ teaspoon salt, ⅛ teaspoon cayenne pepper, 1 cup seedless red grapes, 1 cup cubed watermelon, 1 cup halved fresh strawberries, 1 cup cubed cantaloupe, 1 cup blueberries, 1 cup sliced plums",Fresh Fruit with Poppy Seed Dressing,15 mins,4.5,15 mins,https://www.allrecipes.com/recipe/24371/fresh-fruit-with-poppy-seed-dressing/,"['banana', 'orange', 'lime', 'raspberry', 'vinegar', 'oil', 'raspberry', 'salt', 'cayenne', 'pepper', 'grape', 'watermelon', 'strawberry', 'cantaloupe', 'blueberry', 'plum']",veg,"['banana', 'orange', 'lime', 'raspberry', 'vinegar', 'oil', 'raspberry', 'salt', 'cayenne', 'pepper', 'grape', 'watermelon', 'strawberry', 'cantaloupe', 'blueberry', 'plum']"
60,,"1. Combine blueberries, strawberries, watermelon, and grapes in a bowl; add coconut.","1 cup blueberries, 1 cup sliced strawberries, 1 cup chopped watermelon, 1 cup red grapes, 1 cup shredded coconut",Fourth of July Salad,10 mins,5.0,10 mins,https://www.allrecipes.com/recipe/244450/fourth-of-july-salad/,"['blueberry', 'strawberry', 'watermelon', 'grape', 'coconut']",veg,"['blueberry', 'strawberry', 'watermelon', 'grape', 'coconut']"
136,3 mins,"1. Whisk olive oil, white balsamic vinegar, Dijon mustard, and honey in a small bowl to make dressing. 2. Cut Granny Smith and Red Delicious apples into noodles using a spiralizer fitted with the large shredding blade. 3. Place apple noodles in a large bowl and toss with lime juice to keep them from turning brown. Pour in dressing; mix gently until salad is combined. 4. Place pine nuts in a small skillet over medium-low heat. Toast pine nuts, shaking often, until golden brown, about 5 minutes. Sprinkle pine nuts over salad.","2 tablespoons extra-virgin olive oil, 2 tablespoons white balsamic vinegar, 1 tablespoon Dijon mustard, 1 teaspoon honey, or more to taste, 2 unpeeled Granny Smith apples, 1 unpeeled Red Delicious apple, ½ lime, juiced, 1 tablespoon pine nuts",Spiralized Apple Salad,15 mins,4.0,18 mins,https://www.allrecipes.com/recipe/254373/spiralized-apple-salad/,"['oil', 'vinegar', 'mustard', 'honey', 'apple', 'apple', 'lime']",veg,"['oil', 'vinegar', 'mustard', 'honey', 'apple', 'apple', 'lime']"
180,,"1. Combine tomato, beans, cucumber, and papaya in a large bowl. Toss with garlic and chile pepper. 2. Stir together lemon juice, lime juice, fish sauce, and sugar in a small bowl. Pour over papaya mixture and toss. Sprinkle peanuts and cilantro on top and serve.","1 Roma tomato, chopped, 1 ½ cups fresh green beans, cut into 1/2 inch pieces, 1 cucumber, cut into 1/2 inch cubes, 1 ½ cups cubed papaya, 2 cloves cloves garlic, minced, 1 fresh Thai or Serrano chile, finely minced, 1 lemon, juiced, 2 limes, juiced, 2 tablespoons fish sauce, 1 tablespoon white sugar, ½ cup roasted peanuts, chopped, ¼ cup cilantro leaves, chopped",Thai-Inspired Confetti Salad,35 mins,4.5,35 mins,https://www.allrecipes.com/recipe/141790/thai-inspired-confetti-salad/,"['tomato', 'bean', 'cucumber', 'papaya', 'clove', 'clove', 'garlic', 'lemon', 'lime', 'fish', 'sauce', 'sugar', 'peanut', 'cilantro']",non-veg,"['tomato', 'bean', 'cucumber', 'papaya', 'clove', 'clove', 'garlic', 'lemon', 'lime', 'fish', 'sauce', 'sugar', 'peanut', 'cilantro']"
71,,"1. Combine mango, jalapeno, onion, capsicum, and mint in a bowl. Mix to combine. Season with lemon juice, honey, and red pepper flakes. Mix well.","1 mango - peeled, seeded, and diced, ½ jalapeno pepper, seeded and minced, ¼ small onion, chopped, ⅛ green capsicum, chopped, 2 teaspoons finely chopped mint, or to taste, 1 tablespoon lemon juice, or as needed, 1 teaspoon honey, ½ teaspoon red pepper flakes, or to taste",Spicy Mango Salad with Jalapeno,15 mins,,15 mins,https://www.allrecipes.com/recipe/265813/spicy-mango-salad-with-jalapeno/,"['mango', 'jalapeno', 'pepper', 'onion', 'capsicum', 'mint', 'lemon', 'honey', 'pepper']",veg,"['mango', 'jalapeno', 'pepper', 'onion', 'pepper', 'mint', 'lemon', 'honey', 'pepper']"
134,,"1. Combine watermelon, cantaloupe, blueberries, and strawberries in a large bowl. Mix to combine.","¼ (4 pound) watermelon, peeled and cubed, ½ (3 pound) cantaloupe - peeled, seeded, and cubed, ¼ cup fresh blueberries, ¼ cup quartered fresh strawberries",4th of July Fruit Salad,15 mins,5.0,15 mins,https://www.allrecipes.com/recipe/284321/4th-of-july-fruit-salad/,"['watermelon', 'cantaloupe', 'blueberry', 'strawberry']",veg,"['watermelon', 'cantaloupe', 'blueberry', 'strawberry']"
209,2 mins,"1. Combine the wine and sugar in a saucepan. Place the saucepan over medium heat and bring to a boil; stirring to dissolve sugar. Remove the saucepan from the heat and add the mint; set aside. 2. Combine the cantaloupe, grapes, and strawberries in a large bowl. Pour the wine mixture over the fruit; toss together until all the fruit is covered with the wine mixture; cover and chill. Store in the refrigerator up to 8 hours before serving.","1 ¼ cups dry white wine, ⅓ cup white sugar, 1 tablespoon chopped fresh mint, ½ cantaloupe, cut into bite-size pieces, 1 cup seedless green grapes, halved, 1 pint fresh strawberries, hulled and halved",White Wine Fruit Cocktail,20 mins,4.5,22 mins,https://www.allrecipes.com/recipe/143641/white-wine-fruit-cocktail/,"['sugar', 'mint', 'cantaloupe', 'grape', 'strawberry']",veg,"['sugar', 'mint', 'cantaloupe', 'grape', 'strawberry']"
149,1 hr 30 mins,"1. Pour the applesauce, cherry pie filling, sliced peaches, mandarin oranges, pineapple, brown sugar and cinnamon into a slow cooker. Cover, and cook on Low setting for 90 minutes.","1 (20 ounce) jar chunky applesauce, 1 (21 ounce) can cherry pie filling, 1 (15 ounce) can sliced peaches, drained, 1 (11 ounce) can mandarin orange segments, drained, 1 (8 ounce) can pineapple chunks, ½ cup brown sugar, 1 teaspoon ground cinnamon",Hot Fruit Salad,10 mins,4.5,1 hr 40 mins,https://www.allrecipes.com/recipe/68460/hot-fruit-salad/,"['cherry', 'peach', 'mandarin', 'orange', 'pineapple', 'sugar', 'cinnamon']",veg,"['cherry', 'peach', 'mandarin', 'orange', 'pineapple', 'sugar', 'cinnamon']"
27,,"1. Combine the honeydew, lime juice, cilantro, mint, and sugar in a bowl; toss to combine; refrigerate at least two hours before serving.","4 cups 1-inch chunks honeydew, 1 tablespoon fresh lime juice, 3 tablespoons chopped cilantro leaves and stems, ⅓ cup chopped fresh mint leaves, white sugar to taste",Fresh Mint and Cilantro Melon Salad,15 mins,4.5,2 hrs 15 mins,https://www.allrecipes.com/recipe/149448/fresh-mint-and-cilantro-melon-salad/,"['honeydew', 'lime', 'cilantro', 'mint', 'sugar']",veg,"['honeydew', 'lime', 'cilantro', 'mint', 'sugar']"
81,,"1. Mix pineapple, watermelon, mango, and green apple in a large bowl. 2. Blend lime juice, honey, and jalapeno in a blender until smooth. 3. Pour jalapeno dressing into the large bowl and mix thoroughly. Sprinkle chili-lime seasoning on top. Chill for 1 to 2 hours before serving.","1 (8 ounce) can pineapple chunks, drained, 1 cup cubed, seeded watermelon, 1 mango, peeled and cubed, 1 green apple, cored and sliced, ¼ cup lime juice, 2 tablespoons honey, or more to taste, 1 jalapeno pepper, seeded and chopped, 2 teaspoons chili-lime seasoning (such as Tajin®)",Spicy Fruit Salad,20 mins,5.0,1 hr 20 mins,https://www.allrecipes.com/recipe/258927/spicy-fruit-salad/,"['pineapple', 'watermelon', 'mango', 'apple', 'lime', 'honey', 'jalapeno', 'pepper']",veg,"['pineapple', 'watermelon', 'mango', 'apple', 'lime', 'honey', 'jalapeno', 'pepper']"
153,,"1. Place the tomato, mango, avocado, capsicum, blueberries, onion, and cilantro into a large bowl. Pour the lime juice and pineapple juice overtop. Stir gently until evenly combined. Serve immediately for the freshest taste.","3 vine-ripe tomatoes, diced, 2 mangos - peeled, seeded, and cubed, 2 avocados - peeled, pitted, and cubed, 1 orange capsicum, chopped, 1 cup fresh blueberries, 1 red onion, chopped, ½ bunch cilantro, chopped, ¼ cup fresh lime juice, ½ cup pineapple juice",Summer Rainbow Salad,20 mins,4.0,20 mins,https://www.allrecipes.com/recipe/166866/summer-rainbow-salad/,"['tomato', 'mango', 'avocado', 'orange', 'capsicum', 'blueberry', 'onion', 'cilantro', 'lime', 'pineapple']",veg,"['tomato', 'mango', 'avocado', 'orange', 'pepper', 'blueberry', 'onion', 'cilantro', 'lime', 'pineapple']"
173,20 mins,"1. Combine cantaloupe, honeydew melon, peaches, oranges, strawberries, mangoes, kiwis, blueberries, and raspberries in a large bowl. 2. Whisk cream, confectioners' sugar, and rum together in a bowl until smooth; fold in marshmallows. Pour cream mixture over fruit and toss to coat. Cover bowl and refrigerate, stirring frequently, until chilled and flavors soak into fruit, 8 hours to overnight. 3. Spoon fruit salad into serving bowls and sprinkle with coconut.","1 cantaloupe - peeled, seeded, and cubed, 1 honeydew melon - peeled, seeded, and cubed, 4 large fresh peaches - peeled, pitted, and sliced, 3 oranges, peeled and sliced, 3 cups sliced fresh strawberries, 2 large mangoes - peeled, seeded, and chopped, 4 kiwis, peeled and sliced, 1 pint blueberries, 1 pint fresh raspberries, 1 cup heavy whipping cream, ½ cup confectioners' sugar, ½ cup coconut-flavored rum (such as Malibu®), 1 cup miniature marshmallows, ½ cup shredded coconut",Malibu® Rum Fruit Salad,,4.0,8 hrs 20 mins,https://www.allrecipes.com/recipe/238625/malibu-rum-fruit-salad/,"['cantaloupe', 'honeydew', 'peach', 'orange', 'strawberry', 'mango', 'kiwi', 'blueberry', 'raspberry', 'cream', 'sugar', 'rum', 'marshmallow', 'coconut']",veg,"['cantaloupe', 'honeydew', 'peach', 'orange', 'strawberry', 'mango', 'kiwi', 'blueberry', 'raspberry', 'cream', 'sugar', 'rum', 'marshmallow', 'coconut']"
26,,"1. Toss watermelon, red onion, apple cider vinegar, mint, and black pepper together in a large mixing bowl. Refrigerate until chilled completely, about 1 hour.","6 cups cubed seeded watermelon, ½ red onion, cut into thin half-moon slices, ⅓ cup apple cider vinegar, 2 tablespoons chopped fresh mint, or more to taste, ½ teaspoon ground black pepper",Watermelon Surprize,20 mins,5.0,1 hr 20 mins,https://www.allrecipes.com/recipe/228230/watermelon-surprize/,"['watermelon', 'onion', 'apple', 'vinegar', 'mint', 'pepper']",veg,"['watermelon', 'onion', 'apple', 'vinegar', 'mint', 'pepper']"
209,,"1. Place cranberries, mandarin oranges, and pecans into a food processor and pulse several times to chop; process mixture until finely ground, about 30 seconds. Transfer mixture into a large bowl. 2. Mix pineapple, gelatin, sugar, boiling water, and cold water together in a separate bowl until gelatin and sugar have dissolved. Pour gelatin mixture into cranberry mixture and stir. Pour into a gelatin mold and refrigerate 8 hours or overnight before serving.","2 cups fresh cranberries, 1 (15 ounce) can mandarin oranges, drained and chopped, 1 cup pecans, 1 (15 ounce) can crushed pineapple, drained, 2 (3 ounce) packages cranberry-flavored gelatin mix (such as Jell-O®), ¾ cup white sugar, 1 cup boiling water, 1 cup cold water",Cranberry Jell-O® Salad,15 mins,4.5,8 hrs 15 mins,https://www.allrecipes.com/recipe/229386/cranberry-jell-o-salad/,"['cranberry', 'mandarin', 'orange', 'pecan', 'pineapple', 'sugar', 'water', 'water']",veg,"['cranberry', 'mandarin', 'orange', 'pecan', 'pineapple', 'sugar', 'water', 'water']"
326,,"1. Mix cream cheese and agave nectar together in a large bowl. Stir in green grapes, red grapes, and walnuts. 2. Refrigerate cream cheese mixture for at least 2 hours before serving.","2 cups cream cheese, 1 cup agave nectar, 3 cups seedless green grapes, 3 cups seedless red grapes, 2 cups walnuts",Cream Cheese Grapes,10 mins,4.0,2 hrs 10 mins,https://www.allrecipes.com/recipe/254497/cream-cheese-grapes/,"['cream', 'cheese', 'grape', 'grape', 'walnut']",veg,"['cream', 'cheese', 'grape', 'grape', 'walnut']"
51,,"1. Combine strawberries, sugar, and salt in a bowl. Set aside for 10 minutes. 2. Combine basil, balsamic, and lemon juice in another bowl. Pour over strawberries and toss to coat. Serve.","1 pound fresh strawberries, sliced, 1 tablespoon white sugar, ⅛ teaspoon salt, 2 tablespoons fresh basil leaves, chiffonade, 2 teaspoons balsamic vinegar, 1 teaspoon lemon juice",Lemon-Basil Strawberry Salad,10 mins,5.0,20 mins,https://www.allrecipes.com/recipe/279542/lemon-basil-strawberry-salad/,"['strawberry', 'sugar', 'salt', 'basil', 'vinegar', 'lemon']",veg,"['strawberry', 'sugar', 'salt', 'basil', 'vinegar', 'lemon']"
258,,"1. Toss apple chunks in a bowl with 2 teaspoons tangerine juice. Whisk remaining tangerine juice, sour cream, mayonnaise, sugar, and salt in a bowl until sugar and salt have dissolved. Pour dressing over apple and toss.","1 apple, cored and cut into chunks, 2 tangerines, juiced - divided, 1 tablespoon sour cream, 1 tablespoon mayonnaise, 1 teaspoon white sugar, or more to taste, 1 pinch salt",Crisp Apples with Citrus Dressing,10 mins,4.5,10 mins,https://www.allrecipes.com/recipe/230987/crisp-apples-with-citrus-dressing/,"['apple', 'tangerine', 'cream', 'mayonnaise', 'sugar', 'salt']",veg,"['apple', 'tangerine', 'cream', 'mayonnaise', 'sugar', 'salt']"
232,,"1. Stir pudding mix and reserved liquid from mandarin oranges together in a large bowl until smooth. 2. Stir marshmallows, banana slices, strawberry slices, kiwi slices, and pecans into the pudding mix. 3. Chill 30 minutes before serving.","1 (3 ounce) package lemon pudding mix, 1 (15.5 ounce) can mandarin oranges, drained with liquid reserved, 3 cups miniature marshmallows, 3 bananas, sliced, 1 cup sliced strawberries, 1 kiwis, peeled and sliced (Optional), ½ cup chopped pecans (Optional)",Marshmallow and Fruit Salad,20 mins,4.0,50 mins,https://www.allrecipes.com/recipe/220982/marshmallow-and-fruit-salad/,"['lemon', 'mandarin', 'orange', 'marshmallow', 'banana', 'strawberry', 'kiwi', 'pecan']",veg,"['lemon', 'mandarin', 'orange', 'marshmallow', 'banana', 'strawberry', 'kiwi', 'pecan']"
179,5 mins,"1. In a bowl, mix the vinegar, sugar, oil, paprika, and Worcestershire sauce. Cover, and refrigerate at least 6 hours. 2. Melt butter in a skillet over medium heat. Stir in the almonds, and cook until golden brown. Remove from heat, and cool. 3. In a bowl, toss the strawberries, romaine, and almonds. Mix with the dressing just before serving.","¼ cup apple cider vinegar, ¼ cup sugar, ¼ cup vegetable oil, ¼ teaspoon paprika, 1 dash Worcestershire sauce, 1 tablespoon butter, ½ cup slivered almonds, 1 quart strawberries, 2 romaine hearts, chopped into bite size pieces",Nutty Strawberry Salad,15 mins,4.5,6 hrs 20 mins,https://www.allrecipes.com/recipe/50253/nutty-strawberry-salad/,"['apple', 'vinegar', 'sugar', 'oil', 'paprika', 'worcestershire', 'sauce', 'butter', 'almond', 'strawberry']",veg,"['apple', 'vinegar', 'sugar', 'oil', 'paprika', 'worcestershire', 'sauce', 'butter', 'almond', 'strawberry']"
